source,publication_number,publication_date,title,buyer_name,country,cpv_code,cpv_uri,category,ted_url,raw_text
TED,4254-2025,,"Germany – Architectural, engineering and planning services – Planungsleistungen zur Umbauplanung der Fahrleitungsanlage für die Oststrecke U18 in Mülheim an der Ruhr",Ruhrbahn GmbH,DEU,,,URBANISM_LANDSCAPE,https://ted.europa.eu/en/notice/-/detail/4254-2025,"Die U18 Stadtbahn-Linie wurde 1977 eröffnet und hat 17 Stationen. Sie verbindet die Städte Essen und Mülheim an der Ruhr sowie einige geschäftliche Gebiete miteinander. Beim Essener Teil der Strecke wurde die Fahrleitungsanlage bereits erneuert. Diese Ausschreibung beinhaltet die Planungsleistungen der Leistungsphasen 1 - 6 der HOAI 2021 für die Erneuerung des Mülheimer Teils der zweigleisigen Fahrleitungsanlage. Außerdem ist die Demontage der alten Fahrleitungsanlage inbegriffen. Die Linie U18, die neun Mülheimer Haltestellen anfährt, fährt in vielen Bereichen unterirdisch. Sie weist an keiner Stelle niveaugleiche Kreuzungen mit dem Straßenverkehr auf und entspricht somit einer Voll-U-Bahn. Die Strecke beginnt am Mülheimer Hbf. und endet an der Mülheim-Essener Stadtgrenze. Um einen reibungslosen Betrieb trotz Umbaus gewährleisten zu können, müssen die Arbeiten zum großen Teil in der nächtlichen Betriebspause durchgeführt werden. Auf der zweigleisigen Strecke von 5500 Metern Länge ist die Fahrleitungsanlage als Hochkettenfahrleitung aufzubauen. Durch die Länge der Strecke ist davon auszugehen, dass die Leistungen voraussichtlich in einzelnen Streckenabschnitten aufgeteilt werden müssen. Aufgrund der fehlenden oder veralteten Dokumentation von Bauteilen der Fahrleitungsanlage (Maste, Fundamente, etc.) muss zunächst eine hinreichende Dokumentation erstellt werden. Hierbei müssen unter anderem die Traglast der Maste sowie die Statik überprüft werden. Folgend kann dann entschieden werden, ob die alten Maste noch Verwendung finden oder ersetzt werden müssen. Bei Tiefbauarbeiten sind Baugrunduntersuchungen durchzuführen; hierzu ist eine Planung und Beratung zur Kampfmittelräumung einzubeziehen. Die notwendigen Fachplanungen für die betriebsfertige Erneuerung der Fahrleitungsanlage sind zu erbringen und mit den städtischen Behörden und Ämtern in Mülheim an der Ruhr sowie anderen möglichen Maßnahmenträgern abzustimmen. Weiterführend ist ein Terminplan zu erstellen, hierbei sind die Bauphasen und Verkehrskonzepte auszuarbeiten."
TED,4223-2025,,France – Engineering support services – ASSISTANCE A MAITRISE D'OUVRAGE STRATEGIE DE TRANSFORMATION ET ECONOMIE DU PROJET DE L'HOTEL DIEU A NANTES,"SAMOA, agissant au nom et pour le compte de NANTES METROPOLE",FRA,,,ARCHITECTURE_GENERAL,https://ted.europa.eu/en/notice/-/detail/4223-2025,ACCORD-CADRE MONO-ATTRIBUTAIRE A MARCHES SUBSEQUENTS D'ASSISTANCE A MAITRISE D'OUVRAGE DE STRATEGIE DE TRANSFORMATION ET ECONOMIE DU PROJET DE L'HOTEL DIEU A NANTES
TED,4220-2025,,France – Architectural and related services – PHASE CANDIDATURE - Mission de Maîtrise d'oeuvre pour l'aménagement intérieur des locaux du futur Centre Municipal de Santé de la Plaine,Ville de Saint-Denis,FRA,,,ARCHITECTURE_BUILDING,https://ted.europa.eu/en/notice/-/detail/4220-2025,Il s'agit d'une mission de Maîtrise d'oeuvre pour l'aménagement intérieur des locaux du futur Centre Municipal de Santé de la Plaine.
TED,4215-2025,,"Germany – Architectural, construction, engineering and inspection services – Neubau Bürogebäude Otfried-Müller-Str., Tübingen, Freianlagen",Universitätsklinikum Tübingen,DEU,,,ARCHITECTURE_BUILDING,https://ted.europa.eu/en/notice/-/detail/4215-2025,"Der geplante Neubau soll das Uniklinikum Tübingen den dringenden Flächenbedarf an Bürofläche beherbergen und Ende 2026 fertig gestellt werden. Das Grundstück des geplanten Neubaus befindet sich in der Otfried-Müller-Straße 1 - 72076 Tübingen und liegt im Zugangsbereich zum Klinikareal auf dem Schnarrenberg die sog. Uni-Kliniken Berg. Nördlich des Grundstücks befindet sich die Schnarrenbergstraße und westlich die Hoppe-Seyler-Straße. Im Osten des Grundstücks wurde vor einiger Zeit eine weitere Zugangsmöglichkeit zur Otfried-Müller-Straße aus der Schnarrenbergstraße gebaut, die aufgrund ihrer steilen Steigung im Winter gesperrt ist. Auf dem Grundstück steht eine sehr wichtige Übergabestation für Mittelspannung und Niederspannung des Klinikareals Schnarrenberg, die ca. 1980 in Massivbauweise aus Stahlbeton errichtet wurde und erhalten bleiben muss. Die elektrischen Anlagen, die sich in der Übergabestation befinden, gehören zum UKT und den Stadtwerken Tübingen. Die Anlagen sind in zwei Räumen nach Ihrer Zugehörigkeit (UKT und Stadtwerke) geteilt. Die zum UKT (Universitätsklinikum Tübingen) gehörenden Anlagen wurden in 2011 erneuert. Die zu den Stadtwerken gehörenden Anlagen wurden seit dem Einbau bisher noch nicht modernisiert und sind daher sehr erschütterungsempfindlich. Das bestehende Bauwerk selbst wurde bisher noch nicht saniert. Die Übergabestation verfügt über eine eigene Zufahrt von der Schnarrenbergstraße. Das Flachdach der Übergabestation ist erdüberdeckt. Aufgrund der Hanglage liegt die Fertig-Oberkante des Dachaufbaus der Übergabestation eben mit der südlich angrenzenden Straße, die Otfried-Müller-Straße. Auf dem Grundstück befinden sich viele Leitungen hauptsächlich für Entwässerung und Elektro. Zurzeit stehen einige temporäre Baustellencontainer auf einer geschotterten Fläche oberhalb der Übergabestation."
TED,4195-2025,,"Poland – Architectural and related services – Wykonanie dokumentacji projektowo – kosztorysowej wraz z pełnieniem nadzoru autorskiego w ramach przedsięwzięcia pn. „Poprawa efektywności energetycznej budynków użyteczności publicznej w Gdyni” w podziale na 3 (trzy) części – Szkoła Podstawowa nr 8, Szkoła Podstawowa nr 26, Szkoła Podstawowa nr 51.",Gmina Miasta Gdyni,POL,,,ARCHITECTURE_BUILDING,https://ted.europa.eu/en/notice/-/detail/4195-2025,"CZĘŚĆ 1: Wykonanie dokumentacji projektowo – kosztorysowej wraz z pełnieniem nadzoru autorskiego dla potrzeb kompleksowej modernizacji budynku użyteczności publicznej w Gdyni – Szkoły Podstawowej nr 8 przy ul. Orłowskiej 27/33, kod pocztowy: 81-522, w tym: Zadanie 1 – usługi projektowe, służące przygotowaniu konkretnej inwestycji składającej się na określone zamierzenie budowlane będące niezależną dokumentacją. tj. opracowanie dokumentacji projektowo – kosztorysowej wraz z uzyskaniem kompletu uzgodnień, opinii, odstępstw w rozumieniu Prawa budowlanego i wymaganych prawem decyzji niezbędnych przeprowadzenia robót budowlanych; Zadanie 2 – sprawowanie nadzoru autorskiego nad realizacją robót budowlanych w tym realizacja obowiązków wynikających z ustawy Prawo budowlane tj. stwierdzania w toku wykonywania robót budowlanych zgodności realizacji z projektem, uzgadniania możliwości wprowadzenia rozwiązań zamiennych w stosunku do przewidzianych w projekcie, zgłoszonych przez kierownika budowy lub inspektora nadzoru inwestorskiego."
TED,4188-2025,,"Germany – Architectural, engineering and planning services – BIM-Planungsleistungen für EÜ Magdeburger Tor Str. 6400 km 17,297",DB InfraGO AG – Geschäftsbereich Fahrweg (Bukr 16),DEU,,,URBANISM_LANDSCAPE,https://ted.europa.eu/en/notice/-/detail/4188-2025,"Planung KIB, TWP, VA, Vermessung, Baugrunduntersuchung, sonst. Ingenieurl."
TED,4179-2025,,Spain – Landscape gardening services – Servicio de conservación y mantenimiento de los Jardines de la Biblioteca Nacional de España en las sedes de Madrid y de Alcalá de Henares,Dirección General de la Biblioteca Nacional,ESP,,,URBANISM_LANDSCAPE,https://ted.europa.eu/en/notice/-/detail/4179-2025,Servicio de conservación y mantenimiento de los Jardines de la Biblioteca Nacional de España en las sedes de Madrid y de Alcalá de Henares
TED,4156-2025,,Spain – Civil engineering consultancy services – Redacción del proyecto de redes de trasporte y ejecución de cabezales de los sectores 21-27-28-31-36-39-45-1a de la Acequia Real del Júcar (Valencia).,"Subsecretaría de la Conselleria de Agricultura, Agua, Ganadería y Pesca",ESP,,,ARCHITECTURE_GENERAL,https://ted.europa.eu/en/notice/-/detail/4156-2025,La descripción detallada del objeto del contrato y las necesidades a satisfacer se detallan en el Anexo I al pliego de cláusulas administrativas particulares (PCAP).
TED,4096-2025,,"France – Feasibility study, advisory service, analysis – ASSISTANCE A MAITRISE D'OUVRAGE POUR LA REALISATION DU DOSSIER DE CREATION DE ZONE D'AMENAGEMENT CONCERTE (ZAC) LIEE AU NAUTISME A MANDELIEU-LA NAPOULE",Communauté d'Agglomération des Pays de Lérins (06),FRA,,,ARCHITECTURE_GENERAL,https://ted.europa.eu/en/notice/-/detail/4096-2025,"Le prestataire devra rédiger le rapport de présentation qui expose notamment l’objet et la justification de l’opération. Il devra également produire un plan de situation, un plan de délimitation et une étude d’impact environnementale. Sur le plan juridique, le prestataire accompagnera la collectivité sur le choix de l’exigibilité ou non de la taxe d’aménagement dans la zone, et dans toutes les procédures administratives nécessaires à la validation définitive du dossier de création (délibération et suivi des enquêtes publiques notamment). Le prestataire retenu prendra en charge et assistera la collectivité dans chacune des opérations de concertation préalable à la création de la zone. Deux tranches optionnelles sont également prévues pour le montage et le suivi du dossier d’expropriation, suivant les difficultés rencontrées avec les propriétaires du site."
TED,4088-2025,,"Germany – Architectural, engineering and planning services – Baugrundbeurteilung und geotechnische Beratung inkl. BIM Leistungen ABS 36 Brenner-Nordzulauf Ostermünchen – Kirnstein und Kirnstein – Kiefersfelden (Grenze D/A) (VE 1-0011-207)",DB Netz AG (Bukr 16),DEU,,,URBANISM_LANDSCAPE,https://ted.europa.eu/en/notice/-/detail/4088-2025,Los 2: Kirnstein – Kiefersfelden (Grenze D/A)
TED,4080-2025,,"Germany – Architectural, engineering and planning services – Rahmenvertrag Kleinteilige BIM Planungsleistungen für Bahnsteige und PÜ/PU bis 100 TEUR",Deutsche Bahn AG Konzernleitung (Bukr 10),DEU,,,URBANISM_LANDSCAPE,https://ted.europa.eu/en/notice/-/detail/4080-2025,"Rahmenvertrag Kleinteilige Planungsleistungen Objekt- und Fachplanung für Bahnsteige, Personenunter-/überführungen einschließlich zugehöriger Tragwerksplanung und Technischer Ausrüstung für Einzelabrufe bis 100 T€ Netto Honorar unter Anwendung der BIM-Methodik"
TED,4034-2025,,"Slovakia, Hungary – Construction work – Kassai Labdarúgó Akadémia",SLOVAK SPORT DEVELOPMENT s. r. o.,SVK,,,URBANISM_LANDSCAPE,https://ted.europa.eu/en/notice/-/detail/4034-2025,"A közbeszerzés tárgya Kassai Labdarúgó Akadémiai központ kialakítása – Tervezés és kivitelezés (a továbbiakban: Futballakadémia tervezés és kivitelezése) Kassa (Szlovákia): 1550/1, 1550/46, 1550/65. hrsz. A kivitelezéssel érintett teljes terület 78626 m2. A jóváhagyási dokumentáció alapján a tervezési feladatok a következők: - épület elhelyezési terv (szlovákul projekt pre územné rozhodnutie) - engedélyes tervek és engedélyezési elkészítése beleértve az engedélyek megszerzését is, - kivitelezési tervek és kivitelezési dokumentáció elkészítése beleértve a részletes árazott költségvetés elkészítését is, - megvalósítási tervdokumentáció elkészítése, a Futballakadémia működéséhez szükséges engedélyek megszerzése. A sportlétesítmény terveinek a Szlovák Labdarúgó Szövetség (SFZ) által kiadott, II. ligás labdarúgó mérkőzések lebonyolítására alkalmas követelményeknek kell felelniük. A követelmények a közbeszerzési dokumentumokban érhetők el. A jóváhagyási dokumentáció alapján a kivitelezési feladatok a következők: - egy, tervezetten 4096 m2 alapterületű, négy szintes, téglafaszerkezetű, vasbeton födémből megvalósuló főépület kivitelezése, amely a játékosok, edzők és játékvezetők rendelkezésére áll. A főépület a következő funkciókat kell, hogy megvalósítsa: adminisztratív terek, szálláskapacitások.at is tartalmaz. - 6 futballpálya kivitelezése (4 természetes füves pálya 105 m X 68 m méretű, 2 műfüves pálya 105 m X 68 m méretű ), - legalább 112 parkolóhely kialakítása, - utak, járdák, parkosítás. Ajánlatkérő opciót is határoz meg a kiviteléssel kapcsolatosan a felhívás BT-54. pontjában. Ajánlatkérő rögzíti, hogy a jelen közbeszerzési eljárásnak nem része a bútorbeszerzés valamint a konyhatechnológia."
TED,4029-2025,,"Germany – Architectural, construction, engineering and inspection services – BIM - Daglfinger Kurve - Objekt- und Tragwerksplanung Ingenieurbauwerke Lph 1+2, 3 (Optional 4,5-7)",DB Netz AG (Bukr 16),DEU,,,ARCHITECTURE_BUILDING,https://ted.europa.eu/en/notice/-/detail/4029-2025,"18FEI33118 Höhenfreiheit Daglfinger Kurve - Objekt- und Tragwerksplanung IBW Lph 1+2; Daglfinger Kurve incl. Höhenfreiheit Daglfinger Kurve - Objekt- und Tragwerksplanung IBW Lph 3 (4, 5-7 Optional)"
TED,4-2025,,"Germany – Architectural, engineering and surveying services – Rahmenvertrag für Vermessungsleistungen",HafenCity Hamburg GmbH,DEU,,,ARCHITECTURE_BUILDING,https://ted.europa.eu/en/notice/-/detail/4-2025,Grundleistungen und besondere Leistungen aus dem gesamten LB Vermessung der FHH für Teilbereiche in den Quartieren
TED,3949-2025,,Germany – Architectural services for outdoor areas – Coburg - Amt 65 - Erweiterung Kindertagesstätte Kuckucksnest - Objektplanung Freianlagen,Stadt Coburg,DEU,,,ARCHITECTURE_BUILDING,https://ted.europa.eu/en/notice/-/detail/3949-2025,"Architektenleistungen Objektplanung Freianlagen gemäß Teil 3 Abschnitt 2 der HOAI 2021 Leistungsphasen 5 bis 9 HOAI (66 % der Grundleistungen) Stufenweise Beauftragung: Stufe 1 (LPH 5-7 HOAI) Stufe 2 (LPH 8-9 HOAI) Honorarzone IV Anrechenbare Kosten: ca. 400.000 EUR (netto) Besondere Leistungen: LPH 5: Einarbeiten in die Bestandsunterlagen der LPH 1-4 HOAI LPH 9: Überwachen der Mängelbeseitigung innerhalb der Verjährungsfrist Terminplanung: Ausführungszeitraum der Planungsleistungen: 03/2025 - 05/2027 Geplanter Baubeginn: 10/2025 Geplante Fertigstellung der Maßnahme: 04/2027 Das Hauptgebäude aus dem Jahr 1964 war 1985 für 2 Kindergarten- und 1 Krippengruppe erweitert worden. Jetzt besteht Bedarf für eine zusätzliche Kindergarten- und 1 zusätzliche Kinderkrippengruppe. Aus pädagogischen und organisatorischen Gründen werden jetzt 2 Kinderkrippengruppen im Erweiterungsbau vorgesehen. Der bestehende Krippengruppenraum wird für eine Kindergartengruppe umgenutzt. Der Entwurfsplanung ist die Machbarkeitsstudie vom 28.04.2021 vorausgegangen. Hier wurden verschiedene Varianten untersucht. Die Variante 1 sah einen Anbau hinter, die Variante 2 einen eigenständigen Neubau vor dem Bestandsgebäude vor. In beiden Fällen sollte das vorhandene Gebäude nach der Vorgabe des KGA weitestgehend unangetastet bleiben. Die Variante 2 mit einen nahezu eigenständigen Krippenneubau löst viele Probleme, die bei der Variante 1 sehr starke Hemmnisse verursachen. Die zukünftigen Handlungsmöglichkeiten im Hinblick auf den Bestand (Sanierung, Neubau, etc.) sind maximal. Die Schnittstellen zum Bestand sind baulich und fördertechnisch klar definiert. Eingriffe in den Bestand können minimiert werden. Die Variante 2 wurde auch vom Leitungsteam als verfolgenswert angesehen. Das Gebäude wird als Massivbau errichtet. Im Vorfeld wurde die Holzbauweise untersucht. Die sehr differenzierte Einbindung des Gebäudes in das bestehende Gelände lassen die Voraussetzungen für eine Holzkonstruktion nicht günstig erscheinen. Die preisliche Entwicklung für Bauholz hat über den nun schon länger anhaltenden Preisanstieg nochmals stark an Fahrt aufgenommen. Aufgrund der zum Teil größeren Spannweiten ist ein hoher Materialbedarf erforderlich. Von daher sprechen auch rein wirtschaftliche Gründe gegen eine Baukonstruktion in Holz. Die Ausführung lediglich des Dachtragwerkes aus Holz würde bei der Aussteifung des Mauerwerkskörpers zu unwirtschaftlichen und ggf. schadensträchtigen statischen Maßnahmen führen."
TED,3941-2025,,"Germany – Architectural, construction, engineering and inspection services – Erweiterung der Gewerbegebiete Am Bayersfeld/Bayershofer Weg",Stadt Walsrode,DEU,,,URBANISM_LANDSCAPE,https://ted.europa.eu/en/notice/-/detail/3941-2025,"1. Allgemeine Angaben Mit Beschluss vom 21.02.2023 - Vorlage-Nr. 2020-2026/776 - hat der Rat der Stadt Walsrode die Erweiterung der Gewerbegebiete Am Bayersfeld/Bayershofer Weg beschlossen. Das Plangebiet hat eine Größe von ca. 30 ha. Mit der Erweiterung des Gewerbegebietes wird das Ziel verfolgt, eine hinsichtlich Erschließung und gewerblicher Nutzung konzeptionell zusammenhängende Entwicklung des betroffenen Bereiches zu erreichen. Der derzeitige Industrie- und Gewerbestandort Bayershofer Weg besteht aus dem westlichen Bereich ""Bayershofer Weg"" und dem östlichen Bereich ""Am Bayersfeld"". Der Standort befindet sich in zentraler und verkehrsgünstiger Lage im Industriepark Walsrode. Es existiert ein rechtskräftiger Bebauungsplan. Im westlichen Bereich des Areals sind bereits Unternehmen aus Industrie und Mittelstand angesiedelt. Am vorhandenen Standort sind noch Flächenpoteniale vorhanden, die im kommunalen Eigentum stehen. Die Erweiterung des Gewerbegebietes soll ebenso wie die erstmalige Ausweisung Perspektiven auch für kleine und mittlere Unternehmen im Umfeld des Industrieparks Walsrode schaffen. 2. Planungsrechtliche Grundlage Im Flächennutzungsplan der ehemaligen Gemeinde Bomlitz wurde ein großer Teil der betroffenen Flächen bereits als Gewerbefläche verbindlich ausgewiesen. Die Flächen der rechtskräftigen Bebauungspläne BBP 35 ""Gewerbegebiet Bayershof Weg"", BBP 10 III ""Gewerbegebiet Bayershofer Weg"" und BBP 29 ""Industriegebiet Am Bayersfeld"" sowie BBP 139 ""Bioabfallvergärungsanlage"" wurden zum größten Teil verkauft und bebaut. Bereits seit Jahrzehnten sind am Standort die Firmen Covestro/Epurex (Folienproduktion), die Kontraktlogistikanlagen der Industrieparkunternehmen Wipak und Dow sowie Wehrs Garten- und Landschaftsbau ansässig. Des Weiteren haben sich in dem Gebiet die Firmen AgraForum, Lucky Plant, Biopher International, Fuhrhop Gewässerunterhaltung, Sanz KFZ-Werkstatt, Brandt KFZ-Werkstatt, Barnett sowie die Kommunalservice-Böhmetal angesiedelt. In jüngster Zeit ist das Zentrallager der Firma POCO sowie der Baars Umweltservice hinzugekommen. Weitere kleinere Unternehmen runden das Bild ab. Die Gemeinde Bomlitz hat bereits vor dem 01.01.2020 erhebliche Flächen im Bereich der geplanten Erweiterung erworben. Auf Grundlage eines entsprechenden Ratsbeschlusses aus dem Jahr 2020 wurden von der Stadt Walsrode auch die restlichen Flächen erworben. 3. Leistungsumfang Im Ergebnis dieses EU-weit durchgeführten Vergabeverfahrens wird ein Dienstleister beauftragt, der den gegebenenfalls notwendigen Ankauf weiterer Flächen, die Verwaltung der benötigten Grundstücke, die Bauleitplanung, Erschließung sowie Finanzierung der Gesamtmaßnahme einschließlich des Finanzmanagements im Einvernehmen mit der Stadt Walsrode durchführt. Die näheren Einzelheiten zum Leistungsumfang ergeben sich aus den beigefügten Vergabeunterlagen, insbesondere dem Vertrag über die Erschließung sowie Geschäftsbesorgungsvertrag. Der Vertrag hat eine Laufzeit von 10 Jahren mit einer Verlängerungsoption für die Stadt Walsrode von weiteren 2 Jahren."
TED,3877-2025,,Hungary – Architectural design services – Református Egyetemváros tervezése,Református Egyetemváros Korlátolt Felelősségű Társaság,HUN,,,ARCHITECTURE_BUILDING,https://ted.europa.eu/en/notice/-/detail/3877-2025,"Nyertes ajánlattevő a Szerződés alapján az annak mellékletét képező műszaki leírásban (Műszaki Leírás vagy ML) részletesen rögzített tartalommal az alábbi generáltervezői szolgáltatások (Szolgáltatások) ellátására köteles: I. Campus Projektelem tekintetében: (a) Műszaki Előkészítő feladatok; (b) Koncepcióterv elkészítése; (c) Vázlattervek elkészítése; (d) Engedélyezési Tervek elkészítése; (e) Kivitelezési Tervek elkészítése; (f) Tervezői művezetés (teljesítéséhez külön megrendelés szükséges, ugyanakkor, amennyiben a Beruházás kivitelezésére a tervező kiviteli tervei alapján kerül sor, és szükséges a Tervezői Művezetés ellátása, AK a tervezőtől rendeli meg a Tervezői Művezetési feladatok ellátását. II. Markusovszky tér Projektelem tekintetében (feltételes): (a) Műszaki Előkészítő feladatok; (b) Koncepcióterv elkészítése; (c) Vázlattervek elkészítése; (d) Engedélyezési Tervek elkészítése; (e) Kivitelezési Tervek elkészítése; (f) Tervezői művezetés. A tervezés tárgyának, és pontos tartalmának meghatározását a közbeszerzési dokumentumok részeként rendelkezésre bocsátott Szerződéstervezet és Műszaki Leírás tartalmazza teljes körűen. A Beruházást a Károli Gáspár Református Egyetem új egyetemi campusának létrehozását szolgáló beruházásnak az állami építési beruházások rendjéről szóló törvény alkalmazása alóli mentesítéséről szóló 1521/2023. (XI. 30.) számú Korm. határozat mentesítette az állami építési beruházások rendjéről szóló 2023. évi LXIX. törvény alkalmazása alól. A Beruházást továbbá az 577/2023. (XII. 18.) Korm. rendelet nemzetgazdasági szempontból kiemelt jelentőségű üggyé nyilvánította. Tervezési terület lehatárolása – A tervezési feladat az alábbi területekre terjed ki: Beruházás a 1092 Budapest IX. kerület, Kinizsi u. 30-36. (hrsz: 36840/7) és Üllői út 27. sz. (hrsz: 36840/8) alatt található ingatlanokon (Ingatlan) valósul meg. Figyelembe véve a Szerződéstervezetben a Tervezési Terület és a Tervezési Hatásterület tekintetében meghatározott rendelkezéseket. Tervezési Terület jelenti az Ingatlant, valamint minden olyan kapcsolódó területet – ideértve a környező közterületek érintett részét is – amelyek az Ingatlan és a Beruházás közlekedési kapcsolatai, megközelítési útvonalai, a közműellátás, az esetleges közműkiváltások tekintetében elvégzendő tervezési munkákkal érintettek a Műszaki Leírásban meghatározottak szerint. Így különösen a Kinizsi utca 30-36. (hrsz: 36840/7) és Üllői út 27. (hrsz: 36840/8) ingatlanok (Campus), illetve azok feltárása (gépkocsibehajtók és azok számára szükséges közlekedési rend változásából fakadó igények, gyalogos és kerékpáros feltárási pontok) érdekében a szomszédos közterületek (Kinizsi utca, Üllői út, valamint Markusovszky tér). A Tervezési Hatásterület a Tervezési Terület részét képezi. Tervezési Hatásterület jelenti a Tervezési Területtel határos Üllői út – Kinizsi utca – Ráday utca – Köztelek utca által határolt tömböt, valamint nem saját tulajdonú, de kapcsolódó területként a 1092 Budapest IX. kerület, Markusovszky tér (hrsz.:36847) területét. Feltételes közbeszerzés: Ajánlatkérő tárgyi közbeszerzése vonatkozásában a Campus Projektelem tekintetében a forrás teljes egészében az Ajánlatkérő rendelkezésére áll. A Markusovszky tér Projektelem tekintetében a Beruházás forrása nem áll a Megrendelő rendelkezésére, valamint, mint idegen tulajdont érintő beruházás, a tulajdonos hozzájárulása, adott esetben településrendezési szerződés megkötése is szükséges a Tervezési Feladat megvalósításához. A fentiekre tekintettel a Kbt. 53. § (5) - (6) bekezdéseiben foglaltakra Ajánlatkérő feltételes közbeszerzést indít. A fentiek alapján – figyelemmel a Kbt. 135. § (12) bekezdésében és a Ptk. 6: 116. § (1) bekezdésben foglaltakra - a Szerződés Markusovszky tér Projektelemre vonatkozó rendelkezései hatályba lépésének feltétele egyrészt a forrás rendelkezésre bocsátása, másrészt a tulajdonos hozzájárulása, továbbá a Megrendelő részéről a Tervező Szerződéstervezet szerinti értesítése."
TED,3875-2025,,"Sweden – Architectural, construction, engineering and inspection services – Tekniska konsulter - Skara kommun",Skara kommun,SWE,,,ARCHITECTURE_BUILDING,https://ted.europa.eu/en/notice/-/detail/3875-2025,AF
TED,3868-2025,,"Sweden – Architectural, construction, engineering and inspection services – Teknisk huvudkonsult",Bostads Aktiebolaget Vätterhem,SWE,,,ARCHITECTURE_BUILDING,https://ted.europa.eu/en/notice/-/detail/3868-2025,"Beställaren avser att genom den här förfrågan upphandla ramavtal avseende arkitekttjänster och förmedling av tekniska konsulttjänster för ny-, om- och tillbyggnadsprojekt med därmed förenliga arbetsuppgifter. Projekten är av varierande karaktär, de omfattar framför allt bostäder och lokaler med tillhörande funktioner."
TED,3822-2025,,France – Architectural and related services – ACCORD-CADRE DE MAÎTRISE D'OEUVRE Travaux de rénovation énergétique du Parc Scolaire,CC Portes Sud Périgord,FRA,,,ARCHITECTURE_BUILDING,https://ted.europa.eu/en/notice/-/detail/3822-2025,MARCHE DE MAITRISE D'OEUVRE POUR LA RENOVATION ENERGETIQUE DU PARC SCOLAIRE COMPOSE DE 7 ETABLISSEMENTS
