source,publication_number,publication_date,title,buyer_name,country,cpv_code,cpv_uri,category,ted_url,raw_text
TED,2596-2025,,Czechia – Engineering services – Rozvoj dostupnosti komunitních sociálních služeb – výstavba zázemí služby CHB v lokalitě Nové Město nad Metují – TDS a BOZP,Královéhradecký kraj,CZE,,,URBANISM_LANDSCAPE,https://ted.europa.eu/en/notice/-/detail/2596-2025,"Předmětem veřejné zakázky je zajištění výkonu činnosti technického dozoru stavebníka (TDS) a koordinátora bezpečnosti a ochrany zdraví při práci (BOZP) a poskytnutí souvisejících služeb při realizaci novostavby tří objektů sociální rehabilitace určených pro bydlení a souvisejících zpevněných ploch, sadových úprav, oplocení, demolice stávajícího objektu ČOV, úpravy a rozšíření stávajícího parkoviště, novostavby vodovodní přípojky, venkovního domovního rozvodu vody, přípojky splaškové kanalizace, venkovního domovního vedení gravitační splaškové kanalizace, přípojky dešťové kanalizace, dešťové kanalizace včetně akumulační nádrže dešťových vod a vsakovacího zařízení dešťových vod, přípojky a venkovního domovního rozvodu silnoproudé elektrotechniky, přípojky NTLplynu a venkovního domovního rozvodu NTL plynu. Jedná se o trvalé stavby v katastrálním území Nové Město nad Metují. Objekty budou sloužit 8 klientům v celkem 3 domácnostech a obsahují také zázemí pro personál, který bude přítomen 24 hodin denně. Součástí předmětu díla je provedení funkce TDS a koordinátora BOZP i při dodávce vnitřního vybavení a elektrovybavení. Součástí předmětu díla je dohled na provedením veškerých podmínek pro umístění a provedení stavby vyplývající z rozhodnutí č. j. NMNM/30280/2024/OVRR/HolbV ze dne 27. 9. 2024, které nabylo právní moci dne 22. 10. 2024, včetně splnění podmínek všech DOSS a všech správců sítí. Součástí předmětu díla je dále součinnost při zajištění kolaudace. Přítomnost TDS a koordinátora BOZP je na stavbě vyžadována 5 x v týdnu po 2 hodinách (bez ohledu na dny pracovního volna a svátky). Zadavatel upozorňuje dodavatele na povinnost při stavbě dodržet požadavky na DNSH, které jsou blíže uvedeny v příkazní smlouvě."
TED,2583-2025,,"Poland – X-ray inspection equipment – Dostawa drugiego skanera RTG wraz z budową infrastruktury towarzyszącej, do prześwietlania towarowych wagonów kolejowych w kierunku góra/dół na kolejowym przejściu granicznym w Hrubieszowie.",Izba Administracji Skarbowej w Lublinie,POL,,,ARCHITECTURE_GENERAL,https://ted.europa.eu/en/notice/-/detail/2583-2025,"1. Przedmiotem zamówienia jest dostawa drugiego skanera RTG wraz z budową infrastruktury towarzyszącej, do prześwietlania towarowych wagonów kolejowych w kierunku góra/dół na kolejowym przejściu granicznym w Hrubieszowie. 2. Szczegółowy opis przedmiotu zamówienia, zawarty został w: 1) załączniku nr 7 do SWZ – Wzór umowy, 2) Programie Funkcjonalno-Użytkowym, dalej jako „Program F-U”, stanowiącym załącznik nr 1 do umowy."
TED,255-2025,,"Spain – Retirement home construction work – Contrato de concesión de obras para redacción de proyecto, ejecución de construcción, equipamiento y explotación de una residencia de mayores y centro de día en el Ayuntamiento de Dozón, incluido dentro del Plan de Recuperación, Transformación y Resiliencia - Financiado por la Unión Europea NextGenerationUE",Ayuntamiento de Dozón,ESP,,,ARCHITECTURE_BUILDING,https://ted.europa.eu/en/notice/-/detail/255-2025,"Contrato de concesión de obras para redacción de proyecto, ejecución de construcción, equipamiento y explotación de una residencia de mayores y centro de día en el Ayuntamiento de Dozón, incluido dentro del Plan de Recuperación, Transformación y Resiliencia - Financiado por la Unión Europea NextGenerationUE"
TED,2545-2025,,"Croatia – Supervision of building work – Nadzor nad izvođenjem radova izgradnje brze ceste Osijek – Županja, dionica Nuštar – Vukovar",HRVATSKE CESTE d.o.o. Zagreb,HRV,,,ARCHITECTURE_BUILDING,https://ted.europa.eu/en/notice/-/detail/2545-2025,"Nadzor nad izvođenjem radova izgradnje brze ceste Osijek – Županja, dionica: Nuštar – Vukovar"
TED,2520-2025,,"Czechia – Architectural, engineering and surveying services – Mapování prvků digitální technické mapy v rámci projektu Rozvoj DTM HMP",HLAVNÍ MĚSTO PRAHA,CZE,,,ARCHITECTURE_BUILDING,https://ted.europa.eu/en/notice/-/detail/2520-2025,Předmětem mapování jsou komunikace a vybraná technická infrastruktura. Konkrétní objekty a požadavky na měření jsou uvedeny v zadávací dokumentaci.
TED,2506-2025,,France – Architectural services for buildings – Mission de maîtrise d'oeuvre pour la réhabilitation énergétique &amp;quot;plan Climat Ville de Paris&amp;quot; de 2 résidences,Habitat Social Français,FRA,,,ARCHITECTURE_BUILDING,https://ted.europa.eu/en/notice/-/detail/2506-2025,Milieu occupé Certification Responsable second niveau et le Label Rénovation 150
TED,2499-2025,,Poland – Construction management services – Zarządzanie Projektem pt.: Rozbudowa drogi wojewódzkiej nr 102 na odcinku Trzebiatów – Kołobrzeg,Województwo Zachodniopomorskie,POL,,,ARCHITECTURE_BUILDING,https://ted.europa.eu/en/notice/-/detail/2499-2025,"1. Przedmiotem zamówienia jest świadczenie usługi Zarządzania Projektem pt.: Rozbudowa drogi wojewódzkiej nr 102 na odcinku Trzebiatów – Kołobrzeg. 2. Usługa obejmuje: 1) zarządzanie i koordynację wszystkich czynności związanych z realizacją Projektu; 2) pełnienie nadzoru inwestorskiego i kontrolę nad realizacją robót budowlanych zgodnie z Prawem budowlanym i zawartą umową na roboty budowlane; 3) działania mające na celu terminowe wykonanie robót budowlanych; 4) dokumentowanie postępu robót; 5) wypełnianie obowiązków sprawozdawczych uzgodnionych z Kierownikiem Projektu; 6) sprawowanie nadzoru autorskiego zgodnie z art. 20 ust. 1 pkt 4 ustawy Prawo budowlane z dnia 7 lipca 1994 r. w formie przyjazdów na miejsce prowadzenia robót, a także prac wykonywanych w siedzibie Wykonawcy. Planowana ilość nadzorów: nadzór autorski związany z pobytem na budowie – 30 nadzorów i 70 nadzorów pełnionych w siedzibie Wykonawcy. 3. Zakres robót budowlanych obejmuje rozbudowę drogi wojewódzkiej nr 102 od przejazdu kolejowego na ul. Kołobrzeskiej w m. Trzebiatów do przepustu w km 89+200 w kierunku m. Kołobrzeg o długości ok. 21,6 km oraz remont nawierzchni bitumicznej, który rozpocznie się od przejazdu kolejowego na ul. Kołobrzeskiej, a zakończy przed rondem Niepodległości w m. Trzebiatów. Długość przebudowywanego odcinka pomiędzy Trzebiatowem a Kołobrzegiem wyniesie ok. 21,6 km, zaś remont w m. Trzebiatów obejmie ok. 650 m nawierzchni. Łączna długość obu odcinków wynosi ok. 22,25 km. Zakres robót budowlanych obejmuje m. in.: 1) przebudowę, rozbudowę i wzmocnienie jezdni drogi wojewódzkiej, 2) budowę elementów uspokojenia ruchu, 3) budowę przepustów, 4) budowę chodników, ciągów pieszo-rowerowych, zatok autobusowych, 5) budowę oświetlenia drogowego, 6) usunięcie kolizji z infrastrukturą obcą, 7) regulację urządzeń infrastruktury podziemnej, 8) roboty rozbiórkowe, 9) wycinkę kolidujących drzew i krzewów oraz wykonanie nowych nasadzeń, 10) wykonanie poboczy, 11) wykonanie oznakowania pionowego, poziomego oraz barier ochronnych i urządzeń zabezpieczających pieszych."
TED,2490-2025,,"Bulgaria – Architectural and related services – ,,Проектиране на работен проект за текущ ремонт на главен вход и прилежащи площи, част от съществуваща сграда с ИД 56784.510.1051.2, разположена в ПИ с ИД 56784.510.1051 по КК и КР на гр. Пловдив.“","УНИВЕРСИТЕТСКА МНОГОПРОФИЛНА БОЛНИЦА ЗА АКТИВНО ЛЕЧЕНИЕ ""СВЕТИ ГЕОРГИ"" ЕАД",BGR,,,ARCHITECTURE_BUILDING,https://ted.europa.eu/en/notice/-/detail/2490-2025,",,Проектиране на работен проект за текущ ремонт на главен вход и прилежащи площи, част от съществуваща сграда с ИД 56784.510.1051.2, разположена в ПИ с ИД 56784.510.1051 по КК и КР на гр. Пловдив.“, съгласно техническо задание"
TED,2427-2025,,"Germany – Architectural, engineering and planning services – Planungsleistung: Neubau FWH Worpswede - Freianlagenplanung",Gemeinde Worpswede c/o Landkreis Osterholz - Zentrale Vergabestelle,DEU,,,URBANISM_LANDSCAPE,https://ted.europa.eu/en/notice/-/detail/2427-2025,"Die Gemeinde Worpswede beabsichtigt einen Neubau für die Ortsfeuerwehr Worpswede – Stützpunktfeuerwehr mit Zusatzaufgaben (55 aktive Mitglieder zuzgl.. Jugendfeuerwehr) – mit 8 Fahrzeugboxen, einer Waschhalle sowie den erforderlichen Nebenräumen nach DIN 14092 auf der gemeindeeigenen Fläche an der Bergedorfer Straße zu errichten. Auf dem selben Grundstück soll als 2.Bauabschnitt zu einem späteren Zeitpunkt der Neubau Bauhof Worpswede entstehen. Bei der Planung der Zufahrten und Verkehrswege muss dies berücksichtigt werden. Die Planung des Bauhofes sind nicht Bestandteil dieser Ausschreibung. Das Bauvorhaben soll unter ökologischen und klimafreundlichen sowie nachhaltigen Aspekten, sowie Förderkriterien (z.B. KfW-Förderprogramme) geplant und umgesetzt werden. Die Dächer werden vorgerichtet für PV Solarstrom- und/oder Solarthermieanlagen. Zur Vorbereitung des Neubaus für die Ortsfeuerwehr Worpswede werden mit diesem Verhandlungsverfahren mit Teilnahmewettbewerb die Planungsleistungen für die Freianlagen ausgeschrieben."
TED,2425-2025,,"Germany – Architectural, engineering and planning services – BIM Planungsleistung Sanierung Dach Bahnhof Leer (Ostfriesland)",DB InfraGO AG – Geschäftsbereich Personenbahnhöfe (Bukr 11),DEU,,,URBANISM_LANDSCAPE,https://ted.europa.eu/en/notice/-/detail/2425-2025,BIM Planungsleistung Sanierung Dach Bahnhof Leer (Ostfriesland)
TED,2403-2025,,"Czechia – Project and design preparation, estimation of costs – Předprostor Hlavního nádraží Ostrava (PD+IČ+DP) II.",Statutární město Ostrava,CZE,,,ARCHITECTURE_GENERAL,https://ted.europa.eu/en/notice/-/detail/2403-2025,"Předmětem této nadlimitní veřejné zakázky je vypracování projektových podkladů a zajištění souvisejících činností v rámci přípravy a realizace stavby „Předprostor Hlavního nádraží Ostrava“, v k.ú. Přívoz, obec Ostrava. Rozsah plnění: a) Vypracování dokumentace pro povolení stavby, jejíž součástí bude návrh architektonického řešení blíže specifikovaný v příloze č. 1 zadávacích podmínek. b) Výkon inženýrské činnosti v rozsahu pro zajištění vydání pravomocného rozhodnutí o povolení stavby. c) Vypracování dokumentace pro provádění stavby včetně BIM dokumentace. d) Vypracování Plánu bezpečnosti a ochrany zdraví při práci na staveništi. e) Výkon koordinátora BOZP během přípravy stavby. f) Výkon dozoru projektanta po dobu realizace stavby. g) Ukládání dat do (již zřízeného) jednotného datového prostředí (CDE) zadavatele. Dokumentace pro provádění stavby bude zpracována včetně BIM dokumentace ve stupni podrobnosti A3 a LOD350 (podrobnost definována dokumentem EIR a datovými standardy). Jedná se o rekonstrukci předprostoru hlavního nádraží navazující na projekt „Modernizace železničního uzlu Ostrava“, jehož investorem je Správa železnic, státní organizace a vytvářející nový přestupní terminál městské a příměstské veřejné dopravy. Součástí je také prodloužení tramvajové trati a přeložení stávající tramvajové smyčky dále do ul. Wattova."
TED,2399-2025,,Poland – Construction supervision services – ZARZĄDZANIE I SPRAWOWANIE NADZORU NAD REALIZACJĄ ZADANIA INWESTYCYJNEGO W RAMACH PROJEKTU PN.: PRACE NA LINII KOLEJOWEJ NR1 NA ODCINKACH: KOLUSZKI – CZĘSTOCHOWA ORAZ ZAWIERCIE -DĄBROWA GÓRNICZA,PKP Polskie Linie Kolejowe Spółka Akcyjna,POL,,,ARCHITECTURE_BUILDING,https://ted.europa.eu/en/notice/-/detail/2399-2025,"Przedmiotem Zamówienia jest zarządzanie i sprawowanie nadzoru nad realizacją zadania inwestycyjnego w ramach projektu pn.: ,,Prace na linii kolejowej nr 1 na odcinkach: Koluszki -Częstochowa oraz Zawiercie -Dąbrowa Górnicza”"
TED,2389-2025,,"Croatia – Supervision of building work – USLUGA NADZORA nad izvođenjem radova na modernizaciji, obnovi i elektrifikaciji željezničke pruge Vinkovci - Vukovar",HŽ Infrastruktura d.o.o.,HRV,,,ARCHITECTURE_BUILDING,https://ted.europa.eu/en/notice/-/detail/2389-2025,"usluga nadzora nad izvođenjem radova na modernizaciji, obnovi i elektrifikaciji željezničke pruge Vinkovci - Vukovar"
TED,2388-2025,,"Germany – Architectural, engineering and planning services – 2024-12-bexb-gewerbe-bauleitplanung",Stadt Bexbach,DEU,,,URBANISM_LANDSCAPE,https://ted.europa.eu/en/notice/-/detail/2388-2025,"Aufgrund der hohen Nachfrage nach Gewerbeflächen in Bexbach sollen neue gewerbliche Bauflächen entwickelt werden. Das vorgesehene Plangebiet liegt zwischen dem ""Gewerbegebiet Ost, 2. Bauabschnitt, Teilbereich B"" (Am Butterhügel) und dem Gewerbegebiet ""An der Homburger Straße"". Bei den zu überplanenden Flächen handelt es sich teilweise um Waldfläche, teilweise um landwirtschaftlich genutzte Flächen. Das Plangebiet grenzt im Süden an die Kleinottweiler Straße an, westlich und östlich befinden sich die jeweiligen Gewerbegebiete, im Norden liegen landwirtschaftlich genutzte Freiflächen. Die Grundstücke haben eine Gesamtfläche von ca. 13 ha, davon entfällt eine Fläche von ca. 10 ha auf neu entstehende Gewerbeflächen. Eine Verkleinerung des Geltungsbereiches im Rahmen des weiteren Planaufstellungsverfahrens ist möglich, je nach Möglichkeiten der Erschließung und der Grundstückszuschnitte. Gegenstand dieser Ausschreibung sind die Grundleistungen Leistungsbild Bebauungsplan gemäß § 19 HOAI. Insgesamt sollen die Leistungsphasen 1, 2, 3 des § 19 HOAI vergeben werden. Die einzelnen Leistungsphasen werden stufenweise vergeben; zunächst wird die Leistungsphase 1 vergeben."
TED,2347-2025,,Cyprus – Construction work – Ενεργειακή Αναβάθμιση Κτηρίου Ελεγκτικής Υπηρεσίας της Κυπριακής Δημοκρατίας (Α/4/2023(Ε)),Τμήμα Δημοσίων Έργων,CYP,,,ARCHITECTURE_BUILDING,https://ted.europa.eu/en/notice/-/detail/2347-2025,"Ενεργειακή Αναβάθμιση Κτηρίου Ελεγκτικής Υπηρεσίας της Κυπριακής Δημοκρατίας, που εντάσσεται στις κατηγορίες 45000000, 71200000, 71300000, 71500000 κατά CPV"
TED,23-2025,,Poland – Construction project management services – Usługa pełnienia funkcji Inwestora Zastępczego (z rozszerzonym zakresem obowiązków) przy realizacji inwestycji pod nazwą „Budowa Centrum Edukacji Przyrodniczej MORGI”,Babiogórski Park Narodowy z siedzibą w Zawoi,POL,,,URBANISM_LANDSCAPE,https://ted.europa.eu/en/notice/-/detail/23-2025,"3.1. Przedmiotem zamówienia jest usługa pełnienia funkcji Inwestora Zastępczego (z rozszerzonym zakresem obowiązków) przy realizacji inwestycji pod nazwą „Budowa Centrum Edukacji Przyrodniczej MORGI” (dalej również: „Inwestycja). 3.2. Zamówienie zostało podzielone na etapy: Etap I, II i III oraz Etap IV jako przysługujące Zamawiającemu prawo opcji. 3.3. Inwestor Zastępczy będzie działał w imieniu i na rzecz Zamawiającego na podstawie udzielonych pełnomocnictw (inwestor zastępczy o charakterze pełnomocniczym), w tym m.in. pełnomocnictwa udzielonego w trybie art. 37 ust. 2 PZP. 3.4. Szczegółowy opis przedmiotu zamówienia stanowi załącznik 1 do SWZ. 3.6. Miejsce realizacji umowy: usługa będzie wykonywana w formie zdalnej oraz formie stacjonarnej na terenie realizacji Inwestycji - teren Babiogórskiego Parku Narodowego (poza obszarem Natura 2000), 34-222 Zawoja Widły, województwo Małopolskie, działki nr 22727/13 i 22728/1 obręb 0002 Zawoja lub w innym wskazanym przez Zamawiającego miejscu."
TED,226-2025,,"Romania – Technical assistance services – Sprijin pentru pregatirea aplicatiei de finantare si a documentatiilor de atribuire pentru proiectul regional de dezvoltare a infrastructurii de apa si apa uzata din judetul Botosani, in perioada 2014-2020",S.C. NOVA APASERV S.A. Botosani,ROU,,,ARCHITECTURE_GENERAL,https://ted.europa.eu/en/notice/-/detail/226-2025,"Activitatea 1- Studii si avize la faza SF Activitatea 2 – Elaborare SF si AF inclusiv sprijin în procesul de evaluare a Aplicatiei de finantare pana la aprobarea finala Activitatea 3 – Elaborare proiecte tehnice si detalii de executie, verificarea de catre verificatorii atestati, elaborare documentatie DTAC si a documentatiilor pentru obtinerea tuturor avizelor si a documentatiilor pentru Autorizatia de construire pentru contractele de tip FIDIC Rosu Activitatea 4 – Elaborarea documentatiilor de atribuire pentru contractele de lucrari si sprijin acordat pe parcursul perioadei de desfasurare a licitatiilor Activitatea 5 – Elaborarea documentatiilor de atribuire pentru contractele de servicii / furnizare si sprijin acordat pe parcursul perioadei de desfasurare a licitatiilor. Activitatea 6 - Organizare seminarii (workshop-uri) Activitatea 7 - Asistenta Tehnica in calitate de proiectant pe parcursul executiei lucrarilor, conform Legii 10/1995 Entitatea contractantă are dreptul de a opta pentru achiziţionarea ulterioară de noi servicii, de la operatorul economic a cărui ofertă va fi declarată câştigătoare în cadrul acestei proceduri de atribuire . Valoarea contractului se poate suplimenta cu o suma reprezentand 30% din valoarea TOTAL de la pozitia 25 din ANEXA IV B - DEFALCARE BUGET/ZILE LUCRATOARE din Caietul de sarcini, reprezentand Servicii noi (suplimentare) de Asistenta Tehnica in calitate de proiectant pe toata durata de executie a contractelor de lucrari, conform Legii 10/1995, care vor fi achizitionate doar daca va fi necesar, in temeiul Art. 117, alin(1) lit.f) si alin. (3) din Legea 99/2016. Numar zile pana la care se pot solicita clarificari inainte de data limita de depunere a ofertelor/candidaturilor: 20. Entitatea contractanta va raspunde in mod clar si complet tuturor solicitarilor de clarificari / informatiilor suplimentare cel mai târziu cu 10 zile inainte de data limita de depunere a solicitarilor de clarificari."
TED,2234-2025,,"Poland – Engineering design services for the construction of civil engineering works – Opracowanie dokumentacji projektowej wraz z pełnieniem nadzoru autorskiego w ramach projektu pn.: „Dokumentacja projektowa dla Poznańskiego Węzła Kolejowego""",PKP Polskie Linie Kolejowe S.A.,POL,,,ARCHITECTURE_BUILDING,https://ted.europa.eu/en/notice/-/detail/2234-2025,"Przedmiotem Zamówienia jest Opracowanie dokumentacji projektowej wraz z pełnieniem nadzoru autorskiego w ramach projektu pn.: „Dokumentacja projektowa dla Poznańskiego Węzła Kolejowego"". Całość przedmiotu zamówienia obejmuje wykonanie następujących elementów: 1) Dokumentacji projektowej, w tym: a) Koncepcji Programowo - Przestrzennej (KPP), b) projektów budowlanych wraz z dokumentacją geodezyjną (mapa do celów projektowych), geotechniczną i geologiczno-inżynierską, c) inwentaryzacji przyrodniczej, d) materiałów niezbędnych do uzyskania decyzji o środowiskowych uwarunkowaniach, o których mowa w ustawie z dnia 3 października 2008 r. o udostępnianiu informacji o środowisku i jego ochronie, udziale społeczeństwa w ochronie środowiska oraz o ocenach oddziaływania na środowisko (t. j. Dz. U. z 2023 r. poz. 1094 z późn. zm.) wraz z pozyskaniem przedmiotowej decyzji. e) projektów wykonawczych, f) materiałów przetargowych niezbędnych do wyłonienia wykonawców robót budowlanych (tj. przedmiar robót na bazie KPR, kosztorys Inwestorski, STWiORB), PFU dla branży automatyki i telekomunikacji oraz udział w postępowaniach przetargowych na wybór wykonawcy robót poprzez przygotowanie i przekazanie Zamawiającemu odpowiedzi na pytania zadawane w trakcie postępowań przetargowych o udzielenie zamówienia publicznego na realizację robót budowlanych, aż do zawarcia umowy z Wykonawcą Robót oraz wynikających z tych pytań niezbędnych modyfikacji opracowanych dokumentów; g) uzyskanie opinii niezbędnych do pozyskania decyzji ULLK/ULICP, zgód wodnoprawnych oraz pozwoleń na budowę wraz z przygotowaniem wniosków o pozyskanie przedmiotowych decyzji, h) materiałów do pozyskania zgód wodnoprawnych i) pośrednich potwierdzeń weryfikacji. 2) Zamawiający przewiduje zastosowanie Prawa Opcji nr 1 (zwana także Fazą IA) oraz Prawa Opcji nr 2 (zwana także Fazą II). 2.1). Wykonawca w przypadku skorzystania z Prawa Opcji nr 1: a) pozyska ostateczne decyzje lokalizacyjne (ULLK/ULICP), b) pozyska ostateczne zgody wodnoprawne, c) zaktualizuje projekty budowlane, pozyska i przygotuje komplet materiałów niezbędnych do uzyskania pozwoleń na budowę wraz z pozyskaniem ostatecznych pozwoleń na budowę lub zaświadczeń o niewniesieniu sprzeciwu potwierdzających zgłoszenie zamiaru wykonania robót budowlanych, d) dokona aktualizacji projektów wykonawczych, e) dokona aktualizacji dokumentacji przetargowej oraz materiałów przetargowych, w oparciu o pozyskane decyzje administracyjne. 2.2). Wykonawca w przypadku skorzystania z Prawa Opcji nr 2 zapewni nadzór autorski na czas trwania i odbioru robót budowlanych (od przekazania wykonawcy robót placu budowy do czasu dokonania ostatniego Odbioru końcowego) objętych opracowaną dokumentacją projektową dla przedmiotowego zadania."
TED,2228-2025,,"France – Architectural and related services – Maîtrise d'oeuvre pour les travaux d'aménagement des espaces publics du quartier de Hauteville, dans le cadre du NPNRU",Ville de Lisieux,FRA,,,ARCHITECTURE_BUILDING,https://ted.europa.eu/en/notice/-/detail/2228-2025,Accord-cadre à marchés subséquents
TED,2219-2025,,"Germany – Architectural, engineering and planning services – Bauliche Erneuerung des Klinikums Bayreuth - Zielplanung und Planungsleistungen",Klinikum Bayreuth GmbH,DEU,,,URBANISM_LANDSCAPE,https://ted.europa.eu/en/notice/-/detail/2219-2025,"Gegenstand des Auftrags sind - eine Zielplanung für den Gesamtstandort der Betriebsstätte Klinikum Bayreuth, Preuschwitzerstr. 101, 95445 Bayreuth in Anlehnung an die Empfehlungen AKG (Version 2014) und - Planungsleistungen für den Bauabschnitt 1 der baulichen Erneuerung des Klinikums Bayreuth. Die Planungsleistungen für den Bauabschnitt 1 umfassen die Leistungsbilder - Übergeordnete Koordinierungsleistungen Planer, - Gebäude und Innenräume, - Tragwerksplanung, - Technische Ausrüstung, - Bauphysik sowie - Brandschutz. Es ist eine stufenweise Beauftragung vorgesehen. Mit Zuschlagserteilung werden zunächst die Zielplanung sowie die Leistungsphasen (LP) 1 bis 3 der weiteren genannten Planungsleistungen beauftragt (Vertragsstufe 1). Optional kann der Auftragnehmer ganz oder teilweise mit weiteren Leistungen für die LP 4 (Vertragsstufe 2), LP 5 (Vertragsstufe 3), LP 6 bis 7 (Vertragsstufe 4) und LP 8 (Vertragsstufe 5) beauftragt werden. Ein Anspruch auf Beauftragung der optionalen Leistungen besteht nicht. Inhalt und Umfang der vertraglichen Leistungen ergeben sich im Einzelnen aus dem Vertrag und seinen Anlagen, insbesondere den Unterlagen: - B-1.0: Planungsvertrag (Entwurf) - B-1.1: Leistungsbild Zielplanung - B-1.2: Leistungsbild Planungsleistungen"
TED,2212-2025,,France – Design support services – Assistance à maîtrise d'ouvrage pour la mise en oeuvre du plan baignade,Ville de Saint-Maur-des-Fossés,FRA,,,ARCHITECTURE_GENERAL,https://ted.europa.eu/en/notice/-/detail/2212-2025,"La Ville de Saint-Maur-des-Fossés souhaite bénéficier d'une zone de baignade en milieu naturel, et s'est engagée depuis de nombreuses années dans cette démarche en faisant partie du Syndicat Marne Vive (SMV), en participant annuellement au Big Jump, et en travaillant sur le profil de baignade en partenariat avec SMV. A ce jour, la Marne est toujours sous le régime de l'arrêté préfectoral du 31 juillet 1970, interdisant la baignade en Marne, mais en partant du principe que ce dernier sera levé au vu des résultats encourageants des analyses réalisées pour la conception des profils de baignade, ainsi que du contexte politique favorable, notamment à la suite des JOP, l'objectif est d'ouvrir un site de baignade surveillé et gratuit, lors de la période estivale de mi-juin au 30 août, afin de permettre la réappropriation de la Marne et de ses berges par les habitants. Compte tenu du calendrier et de la complexité du dossier, et sous réserve de la levée de l'interdiction de baignade actuellement en vigueur, une démarche en deux temps est envisagée : 1. Eté 2025 : Ouverture de la baignade dans des conditions transitoires, que ce soit en termes de site, d'aménagements, voire d'autorisations, s'il s'agissait de baignades événementielles ; 2. A partir de 2026 : baignade pérenne, dans la former d'organisation et sur le plan administratif"
