source,publication_number,publication_date,title,buyer_name,country,cpv_code,cpv_uri,category,ted_url,raw_text
TED,584-2025,,Germany – Architectural and related services – Südliche Anbauten Haus 23 DEF - Objektplanung Gebäude LPH 8 und 9,"Landesbetrieb Bau und Immobilien Hessen, Niederlassung Mitte Zentrale Vergabe",DEU,,,ARCHITECTURE_BUILDING,https://ted.europa.eu/en/notice/-/detail/584-2025,abc
TED,5788-2025,,"France – Architectural, engineering and planning services – Mission de Maîtrise d'oeuvre - Construction de 44 (minimum) Logements Locatifs - Ancienne &amp;quot;Barre AB&amp;quot; - POINTE-A-PITRE",Société Immobilière de la Guadeloupe,FRA,,,URBANISM_LANDSCAPE,https://ted.europa.eu/en/notice/-/detail/5788-2025,"&amp;lt;br/&amp;gt;Le détail des missions confiées au titulaire figure au cahier des charges.&amp;lt;br/&amp;gt;Les prestations sont réglées par des prix forfaitaires.&amp;lt;br/&amp;gt;Construction d'un ensemble immobilier collectif, avec stationnements.&amp;lt;br/&amp;gt;"
TED,5771-2025,,"Italy – Project and design preparation, estimation of costs – Servizi tecnici di progettazione definitiva ed esecutiva, di coordinamento per la sicurezza dei lavori di restauro del palazzo degli Uffici Finanziari in Nuoro, via Lamarmora NUD0018",Direzione Regionale Sardegna - Agenzia del Demanio,ITA,,,ARCHITECTURE_BUILDING,https://ted.europa.eu/en/notice/-/detail/5771-2025,"Servizi tecnici di progettazione definitiva ed esecutiva, di coordinamento per la sicurezza in fase di progettazione e della relativa attività legata al Building Information Modeling (BIM), in applicazione dei criteri ambientali minimi di cui al D.M. 23 giugno 2022, dei lavori di restauro e adeguamento funzionale del palazzo degli uffici finanziari, sito in Nuoro, via La Marmora – scheda patrimoniale NUD0018"
TED,5767-2025,,Czechia – Construction-related services – Stavba č. 42837 Rekonstrukce Gymnázia prof. J. Patočky; projektant,HLAVNÍ MĚSTO PRAHA,CZE,,,ARCHITECTURE_BUILDING,https://ted.europa.eu/en/notice/-/detail/5767-2025,"Předmětem plnění zadávané veřejné zakázky (dále jen „Stavba č. 42837 Rekonstrukce Gymnázia prof. J. Patočky; projektant“) je: a)zhotovení studie etap stavby, vč. odhadu stavebních nákladů, b)zhotovení dokumentace pro vydání společného povolení (územníhorozhodnutí a stavebního povolení) ve smyslu ustanovení § 94 zákona č.183/2006 Sb., o územním plánování a stavebním řádu (stavební zákon), vplatném znění, vč. sestavení předběžného (orientačního) rozpočtu stavby, c)zhotovení projektové dokumentace pro provádění stavby v rozsahudokumentace pro zadání veřejné zakázky na stavební práce ve smysluustanovení § 92 odst. 1 písm. a) ZZVZ a soupisu stavebních prací, dodávek aslužeb s výkazem výměr ve smyslu ustanovení § 92 odst. 1 písm. b) ZZVZ, d)výkon autorského dozoru při výstavbě ve smyslu ustanovení § 152 odst. 4stavebního zákona, e)výkon inženýrské (obstaravatelské) činnosti pro vydání společnéhopovolení ve smyslu ustanovení § 94j a násl. stavebního zákona, ke stavbě č. 42837 Rekonstrukce Gymnázia prof. J. Patočky."
TED,5735-2025,,"Germany – Architectural, engineering and planning services – Elektrifizierung ABS Weimar-Gera-Gößnitz Planungsleistungen Lph 1 und 2 und Optional 3, 4, 6 und 7",DB Netz AG (Bukr 16),DEU,,,URBANISM_LANDSCAPE,https://ted.europa.eu/en/notice/-/detail/5735-2025,"Planungsleistungen Lph 1 und 2 sowie optional 3, 4, 6 und 7 für die Elektrifizierung auf den Strecken 6307 Abschnitt Weimar – Jena-Göschwitz – Gera und 6268 Abschnitt Gera-Gößnitz mit nachfolgenden Leistungsbildern: — Objektplanung Verkehrsanlagen, — Objektplanung Ingenieurbauwerke, — Ingenieurbauwerke Tragwerksplanung, — Technische Streckenausrüstung."
TED,5712-2025,,Spain – Supervision of building work – Servicio de dirección de obra y coordinación de seguridad y salud de las obras de emergencia DANA-2024 de rehabilitación de la carretera CV-42 entre los pks 0+000 y 9+400 y de reparación de la estructura sobre el río Magro en el pk 4+500. T.M. Alzira y Algemesí (València),"Conseller de Medio Ambiente, Infraestructuras y Territorio de la Generalitat Valenciana",ESP,,,ARCHITECTURE_BUILDING,https://ted.europa.eu/en/notice/-/detail/5712-2025,Servicio de dirección de obra y coordinación de seguridad y salud de las obras de emergencia DANA-2024 de rehabilitación de la carretera CV-42 entre los pks 0+000 y 9+400 y de reparación de la estructura sobre el río Magro en el pk 4+500. T.M. Alzira y Algemesí (València)
TED,5710-2025,,"Germany – Architectural, engineering and planning services – BIM-Planung Braunschweig Hauptbahnhof | Los 1 50 Hz, Los 2 ITK, Los 3 HLSK/GA",DB InfraGO AG – Geschäftsbereich Personenbahnhöfe (Bukr 11),DEU,,,URBANISM_LANDSCAPE,https://ted.europa.eu/en/notice/-/detail/5710-2025,Los 1 – Elektronische Anlagen (50 Hz)
TED,5653-2025,,"France – Architectural, engineering and planning services – Mission de Maîtrise d'oeuvre - Construction de 19 (minimum) Logements Locatifs - Quartier Fond Budan - BAIE-MAHAULT",Société Immobilière de la Guadeloupe,FRA,,,URBANISM_LANDSCAPE,https://ted.europa.eu/en/notice/-/detail/5653-2025,"&amp;lt;br/&amp;gt;Le détail des missions confiées au titulaire figure au cahier des charges.&amp;lt;br/&amp;gt;Les prestations sont réglées par des prix forfaitaires.&amp;lt;br/&amp;gt;Construction d'un ensemble immobilier, individuel ou semi-individuel, avec stationnements.&amp;lt;br/&amp;gt;"
TED,5633-2025,,"Germany – Architectural, engineering and planning services – Dienstleistungen von Architekturbüros (Gebäude u. Freianlagen) sowie Fachplanungsleistungen (Brandschutz) für die Maßnahme - Erweiterung für den Ganztag an der Brüder-Grimm-Schule in Friedberg/Dorheim",Wetteraukreis - FS 1.5.1 Zentrale Vergabestelle,DEU,,,URBANISM_LANDSCAPE,https://ted.europa.eu/en/notice/-/detail/5633-2025,"Für die Brüder-Grimm-Grundschule soll ein neuer Erweiterungsbau auf dem kreiseigenen Grundstück errichtet werden. Die Schule verfügt über eine Abteilung mit dem Förderschwerpunkt Sprachheil-förderung, die in ein System vorschulischer, schulischer und außerschulischer Fördermaßnahmen für Kinder mit Sprachbeeinträchtigungen bzw.-behinderungen integriert ist. Dies ist die einzige Schule im Wetteraukreis mit einer Sprachheilförderung. Sowohl die steigende Zahl von Schüler/innen als auch die weitere Entwicklung des Ganztags führt zu einem Raumbedarf an der Schule. Der Erweiterungsbau erhält gemäß des Raumprogramms unter anderem zusätzliche Klassenräume, eine Mensa, Betreuungsräume und Nebenräume. Die neuen Räume können entweder in einem Anbau oder separatem Erweiterungsbau geschaffen werden. Die genaue Lage auf dem Grundstück ist im Zuge der ersten Leistungsphasen zu ermitteln und abzustimmen. Optional sind kleinere Anpassungen im Bestand erforderlich. Informationen zum Raumprogramm sowie der Leitfaden ""Wirtschaftliches Bauen"" des Wetteraukreises werden dem Planer nach Auftragserteilung übergeben. Das kreiseigene Schulgrundstück liegt unter anderem: - im Geltungsbereich eines Bebauungsplanes - im Trinkwasserschutzgebiet Das Gebiet liegt direkt an einer Bahntrasse und ist als Altlastenfläche gekennzeichnet. Weitere Einzelheiten sowie den Umfang der zu erbringenden Planerleistungen und den vorgesehenen Stufen A und B entnehmen Sie bitte der als Anlage 01 beigefügten Bau-, Objekt- und Leistungsbeschreibung. Die Bieter können nur ein Honorarangebot (gem. Anlage 12 Angebotsvordruck im Excel-Format oder Anlage 11 Angebotsvordruck im pdf-Format) für die Baumaßnahme abgeben. Die entsprechenden anrechenbaren Kosten sind bereits in dem Angebotsvordruck vorgegeben und dürfen nicht verändert werden. Dies gilt ebenfalls für den weiteren Inhalt. Die Leistungen werden stufenweise beauftragt. Zunächst erfolgt die Beauftragung der Leistungsphasen 1-4 (Stufe A) sowie nach Abruf und schriftlicher Benachrichtigung, die der Leistungsphase 5-9 (Stufe B). Der Auftragnehmer generiert durch die Stellung eines Angebotes für den kompletten Leistungsumfang keinen Anspruch auf die Beauftragung der Stufe B. Der Auftraggeber darf die Leistungen der Stufe B ohne vorherige Durchführung eines weiteren Vergabeverfahrens an den Auftragnehmer beauftragen, bzw. ohne Benennung von Gründen von einer weiteren Beauftragung absehen (siehe § 3 Besondere Vertragsbedingungen). Mit der Einreichung seines Angebotes verpflichtet sich der Auftragnehmer die folgende Leistung später zu erbringen, da deren Umfang im Vorfeld nicht vollumfänglich ersichtlich sind (z. B. wegen noch fehlender Planungsgrundlage oder noch fehlender Bestandsaufnahme): 1. Für die Leistungen für den Brandschutz nach AHO muss unter Berücksichtigung der Baumaßnahme ein Brandschutzkonzept erarbeitet werden. Da der Umfang noch nicht feststeht, bzw. dieser erst nach Fertigstellung näher definiert werden kann, erfolgt keine Preisabfrage. Vor Abruf dieser Leistungen ) treffen der Auftraggeber und der Auftragnehmer eine Honorarvereinbarung."
TED,5626-2025,,"Italy – Feasibility study, advisory service, analysis – Procedura telematica aperta per l’aggiudicazione dei servizi tecnici di redazione del documento di fattibilità delle alternative progettuali relativo al “Collegamento funiviario tra la località turistica di Cogne ed il comprensorio di Pila nel Comune di Gressan”",Pila S.p.A,ITA,,,ARCHITECTURE_GENERAL,https://ted.europa.eu/en/notice/-/detail/5626-2025,"I Servizi hanno ad oggetto la redazione del Documento di fattibilità delle alternative progettuali, ai sensi dell’art. 41, comma 2, del decreto legislativo 31 marzo 2023, n. 36 (di seguito anche il “Codice”) e dell’art. 2 dell’Allegato I.7 al Codice."
TED,559-2025,,Poland – Construction supervision services – Inżynier Kontraktu dla Zadania pn. „Modernizacja dwóch lewobrzeżnych Kolektorów Burzowych Mostowa/Boleść oraz Krasińskiego wraz z ich wylotami w kierunku rz. Wisły”.,Miejskie Przedsiębiorstwo Wodociągów i Kanalizacji w m. st. Warszawie S.A.,POL,,,ARCHITECTURE_BUILDING,https://ted.europa.eu/en/notice/-/detail/559-2025,Przedmiotem zamówienia jest nadzór nad Robotami wykonywanymi w ramach Kontraktu na Roboty pn.: „Modernizacja dwóch lewobrzeżnych Kolektorów Burzowych Mostowa/Boleść oraz Krasińskiego wraz z ich wylotami w kierunku rz. Wisły” (szczegółowy opis zawiera Część III SWZ).
TED,5587-2025,,"Spain – Construction work for buildings relating to health and social services, for crematoriums and public conveniences – Contrato de Obras de Construcción del Centro específico de enfermos mentales y Centro de día para personas con discapacidad en la Pedrera de Dénia y Residencia para personas mayores dependientes de San Mateu, mediante su división en 2 lotes y por tramitación anticipada y urgente, por procedimiento abierto. Fondos MRM",Vicepresidencia y Conselleria de Igualdad y Políticas Inclusivas,ESP,,,ARCHITECTURE_BUILDING,https://ted.europa.eu/en/notice/-/detail/5587-2025,Residencia para personas mayores dependientes de Sant Mateu
TED,5580-2025,,Spain – Cleaning services of transport equipment – PLAN DE CONTRATACIÓN 2025,Dirección General Económico-Financiera de la Entidad Pública Empresarial RENFE-Operadora,ESP,,,ARCHITECTURE_GENERAL,https://ted.europa.eu/en/notice/-/detail/5580-2025,
TED,555-2025,,Poland – Engineering design services – Opracowanie dokumentacji projektowej dot. nadbudowy oficyny B budynku A wraz z przebudową budynku A Ministerstwa Infrastruktury przy ul. Chałubińskiego 4 w Warszawie i pełnienie nadzoru autorskiego.,Ministerstwo Infrastruktury,POL,,,ARCHITECTURE_GENERAL,https://ted.europa.eu/en/notice/-/detail/555-2025,"Uwaga numeracja przeniesiona z SWZ 2.1 Przedmiotem zamówienia jest opracowanie dokumentacji projektowej dot. nadbudowy oficyny B budynku A wraz z przebudową budynku A Ministerstwa Infrastruktury przy ul. Chałubińskiego 4 w Warszawie i pełnienie nadzoru autorskiego, w podziale na Etapy, tj.: a) Etap I: wykonanie wielobranżowego projektu koncepcyjnego, b) Etap II: opracowanie projektu budowlanego, projektu wykonawczego, specyfikacji technicznej wykonania i odbioru robót budowlanych (STWiORB), przedmiaru robót, kosztorysu inwestorskiego, c) Etap III: uzyskanie w imieniu inwestora, na podstawie odrębnego pisemnego upoważnienia niezbędnych do realizacji inwestycji pozwoleń oraz decyzji, a także wszelkich uzgodnień, opinii i zaleceń właściwych podmiotów i organów, d) Etap IV: pełnienie nadzoru autorskiego oraz udział w charakterze biegłego na etapie postępowania przetargowego na wybór wykonawcy robót dla inwestycji, e) Etap V: pełnienie nadzoru autorskiego na etapie realizacji robót dla inwestycji do ich ukończenia i odbioru. 2.3 Opis przedmiotu zamówienia zawarty jest w Załączniku nr 1 do SWZ."
TED,5535-2025,,"Germany – Architectural and related services – Generalplaner für den Neubau eines nachhaltigen, innovativen Mehrfamilienhauses in Holzweise, Kuckhoffstr.60, Berlin-Pankow-Niederschönhausen",Bundesanstalt für Immobilienaufgaben,DEU,,,ARCHITECTURE_BUILDING,https://ted.europa.eu/en/notice/-/detail/5535-2025,"Der Vorgelagerte Planungswettbewerb hatte zur Grundlage einen Entwurf eines Wohngebäudes mit 10 - 15 Wohnungen und einer anzustrebenden Wohnfläche von circa 968 m² auf dem in Teil B der Auslobung genauer bezeichneten Wettbewerbsgebiet in der Kuckhoffstraße 60, in 13156 Berlin-Niederschönhausen zu erstellen. Dieses VgV Verfahren umfasst die Realisierung des Wettbewerbsergebnisses."
TED,5456-2025,,"Germany – Architectural and related services – Ersatzneubau Kindertageseinrichtung SpielWerk, Beutlerpark, OPFA","Landeshauptstadt Dresden, GB Stadtentwicklung, Bau, Verkehr und Liegenschaften, Amt f. Hochbau u. Immobilienverwaltung",DEU,,,URBANISM_LANDSCAPE,https://ted.europa.eu/en/notice/-/detail/5456-2025,"Gegenstand der geplanten Beauftragung sind die planerische und bauliche Umsetzung der Projekthaupt- und Teilziele, die in der Bedarfsplanung und dieser Aufgabenstellung festgeschrieben sind, Grundleistungen der Objektplanung Freianlagen der Leistungsphasen (Lph) 2 bis 9 gemäß HOAI § 39 ff sowie ausgewählte Besondere Leistungen der HOAI und projektspezifische Leistungen für die klimaneutrale Errichtung eines bedarfsgerechten Ersatzneubaus in zweigeschossiger Holzbauweise, Am Beutlerpark 6 in 01217 Dresden. Die Beauftragung erfolgt entsprechend dem Vertrag (Anlage 1) stufenweise und nach einzelnen Leistungsphasen. Mit Abschluss des Vergabeverfahrens wird vertraglich die Leistungsphase 2 für o. g. Leistungen beauftragt. Des Weiteren werden entsprechend Vertrag (Anlage 1) Besondere Leistungen gefordert. Hinweis benannte Anlagen: gemeint sind die Anlagen der Aufgabenstellung (siehe Vergabeunterlagen)"
TED,5455-2025,,"Czechia – Project and design preparation, estimation of costs – Zjednodušená projektová dokumentace",Ředitelství silnic a dálnic s. p.,CZE,,,ARCHITECTURE_GENERAL,https://ted.europa.eu/en/notice/-/detail/5455-2025,"Předmětem plnění veřejných zakázek zadávaných v zavedeném DNS bude zpracování zjednodušené projektové dokumentace a s tím související inženýrská činnost, technická podpora, autorský dozor a související služby při zajišťování zpravidla neinvestičních údržbových prací a oprav souvisejících s běžnou údržbou svěřeného majetku. Tyto lze zadávat také jako soubor plánovaných akcí na dané období. Součástí zpracování zjednodušené projektové dokumentace je příprava investorských rozpočtů a soupisů prací a služeb zpracovaných zpravidla podle ceníků OTSKP, případně ÚRS nebo provozních a dalších ceníků dle požadavku objednatele. Využití položek pro inženýrskou činnost je nutné například při jednání s úřady ve věcech různých druhů povolení, vyjednání přístupů, dočasných záborů atd. S ohledem na nižší náročnost, malý rozsah a relativně nízkou hodnotu jednotlivých zakázek nebude pro tento typ dokumentace použita tzv. Bílá kniha Smluvních podmínek. Údržbové práce ve smyslu běžné údržby zpravidla nevyžadují zpracování projektové dokumentace dle Směrnice a rozsah prací bude specifikován konkrétní smlouvou. Zjednodušená projektová dokumentace může být požadována kromě stavebních prací také na služby. Zejména se jedná například o čištění příkopů nebo jiných objektů vyžadujících před zadáním samotných údržbových prací zpracování podrobnějšího časově náročného pasportu, který z kapacitních důvodů nemůže zajistit Zadavatel. Přesná specifikace bude uvedena v konkrétní smlouvě. Smlouvy budou uzavírány jednotlivými provozními jednotkami Zadavatele, dle potřeby, pro jednu nebo více plánovaných akcí, zpravidla na dobu jednoho roku, dle plánu akcí pro následující období."
TED,5454-2025,,France – Architectural services for outdoor areas – MISSION DE MAITRISE D'OEUVRE AMENAGEMENT D'UN PUMPTRACK A PROXIMITE DE LA SALLE OMNISPORT,Mairie de Faverges-Seythenex,FRA,,,ARCHITECTURE_BUILDING,https://ted.europa.eu/en/notice/-/detail/5454-2025,"Mission complète de maitrise d'oeuvre. Les futurs travaux porteront sur l'aménagement d'un Pumptrack avec 2 pistes de niveaux de pratiques distincts, sur un terrain communal de 2530 m² env. Y compris aménagement des abords, d'une aire de repos ombragée et d'une surface d'apprentissage du vélo"
TED,5413-2025,,Latvia – Architectural design services – Būvprojekta izstrāde un autoruzraudzība ”Cēsu klīnikas Diagnostikas korpusa ambulatoro sekundāro un primārās veselības aprūpes telpu pārbūvei”,SIA “CĒSU KLĪNIKA”,LVA,,,ARCHITECTURE_BUILDING,https://ted.europa.eu/en/notice/-/detail/5413-2025,Būvprojekta izstrāde un autoruzraudzība ”Cēsu klīnikas Diagnostikas korpusa ambulatoro sekundāro un primārās veselības aprūpes telpu pārbūvei”
TED,5402-2025,,"France – Architectural and related services – Missions d'Assistance Technique à Maîtrise d'Ouvrage (ATMO) et de programmation immobilière dans le cadre du projet de réhabilitation technique et énergétique du bâtiment de l'Institut de Biologie de l'Ecole Normale Supérieure, dit IBENS.",EPAURIF,FRA,,,ARCHITECTURE_BUILDING,https://ted.europa.eu/en/notice/-/detail/5402-2025,"Les prestations faisant l'objet du présent marché concernent des missions d'assistance technique à la maîtrise d'ouvrage (ATMO) et de programmation immobilière dans le cadre du projet de réhabilitation technique du bâtiment de l'Institut de Biologie (IBENS) de l'Ecole Normale Supérieure (ENS-PSL), situé au 46 rue d'Ulm à Paris 5ème."
TED,5399-2025,,"Poland – Architectural and related services – Wykonanie dokumentacji projektowej dla zadania: „Zagospodarowanie terenu działki nr 29, nabrzeża i obrzeża, platforma treningowa przy Kanale Młyńskim – inwestycja POSRM”",Politechnika Morska w Szczecinie,POL,,,ARCHITECTURE_BUILDING,https://ted.europa.eu/en/notice/-/detail/5399-2025,"1) Przedmiotem zamówienia jest wykonanie kompletnej dokumentacji projektowej w ramach inwestycji POSRM, dla następującego zakresu planowanych prac:  zagospodarowanie terenu działki nr 29,  nabrzeża i obrzeża rzeki Odry i Kanału Młyńskiego (etap II i III wg nomenklatury programu inwestycji), wraz z pogłębianiem dna,  platforma treningowa przy Kanale Młyńskim,  oświetlenie terenu,  monitoring na terenie inwestycji,  infrastruktura łączności bezprzewodowej Wi-fi na terenie inwestycji,  pozostała niezbędna infrastruktura techniczna, sieciowa, instalacyjna na terenie działki nr 29. Szczegółowy opis przedmiotu zamówienia znajduje się w załączniku nr 1a do SWZ – Opis Przedmiotu Zamówienia (OPZ) oraz załącznikach do niego, w tym w szczególności we wstępnych opracowaniach koncepcyjnych. W zakres przedmiotu zamówienia wchodzi uzyskanie ostatecznej i prawomocnej decyzji o udzieleniu pozwolenia na budowę. Uwaga – w zakres przedmiotu zamówienia wchodzi aktualizacja – w uzgodnieniu z Zamawiającym i odpowiednim organem – raportu o oddziaływaniu na środowisko oraz uzyskanie zamiennej decyzji o środowiskowych uwarunkowaniach zgody na realizację przedsięwzięcia (oryginalne dokumenty znajdują się wśród załączników do opisu przedmiotu zamówienia – Zał. nr 5 do OPZ). Wykonawca (po ewentualnych uzgodnieniach z organem) sporządzi aktualizację raportu dla całej inwestycji POSRM, porównując ostateczne parametry projektowanych (w tym już wykonanych oraz posiadających pozwolenie na budowę) elementów składowych inwestycji (zarówno na działce nr 29, jak i na działce nr 28/8) i – jeśli będzie to wymagane przez organ – uzyska decyzję zmieniającą posiadaną decyzję o środowiskowych uwarunkowaniach. W Załączniku nr 3 do OPZ Zamawiający udostępnił wszystkie projekty wcześniej zatwierdzone (część już zrealizowano). W związku z faktem, iż dokumentacja będąca przedmiotem niniejszego zamówienia jest ostatnim etapem inwestycji, powstaje konieczność porównania założeń wyjściowych (z czasu sporządzania pierwotnego raportu o oddziaływaniu na środowisko) oraz parametrów zrealizowanych i zaprojektowanych jako ostateczne. Uwaga 2 – dla przedmiotowej działki istnieje uchwalony Miejscowy Plan Zagospodarowania Przestrzennego (Uchwała nr XXIX/730/17 Rady Miasta Szczecin z dnia 25.04.2017 r. w sprawie miejscowego planu zagospodarowania przestrzennego „Tor Wodny” w Szczecinie). Zapisy planu obowiązują Wykonawcę i na Nim spoczywa odpowiedzialność za zgodność projektu z planem. Ponadto w zakresie przedmiotu zamówienia jest sporządzenie wymaganych opracowań pobocznych oraz przeprowadzenie niezbędnych procedur administracyjnych i uzyskanie koniecznych dla zrealizowania przedmiotu zamówienia decyzji, postanowień, warunków technicznych, uzgodnień i innych, takich jak w szczególności: sporządzenie mapy do celów projektowych, opracowanie dokumentacji geologicznej, sporządzenie operatu wodnoprawnego, uzyskanie pozwoleń wodnoprawnych, decyzji zezwalającej na wykonywanie robót budowlanych w obrębie portu morskiego, decyzji wyłączającej spod zakazu wykonywania robót budowlanych na obszarach zalewowych oraz uzyskanie wszelkich innych uzgodnień, postanowień i decyzji administracyjnych niezbędnych dla zrealizowania przedmiotu zamówienia. Sprawowanie nadzoru autorskiego nie jest elementem przedmiotu zamówienia. Zamawiający może zlecić pełnienie nadzoru autorskiego wybranemu przez siebie projektantowi w ramach oddzielnego postępowania. 2) Nomenklatura CPV 71200000-0 Usługi architektoniczne i podobne 71420000-8 Architektoniczne usługi zagospodarowania terenu 71220000-6 Usługi projektowania architektonicznego 71240000-2 Usługi architektoniczne, inżynieryjne i planowania 71320000-7 Usługi inżynieryjne w zakresie projektowania 71327000-6 Usługi projektowania konstrukcji nośnych 71322000-1 Usługi inżynierii projektowej w zakresie inżynierii lądowej i wodnej 71352000-0 Usługi badania podłoża 71244000-0 Kalkulacja kosztów, monitoring kosztów 3) Podane przez Zamawiającego ewentualne nazwy (znaki towarowe), normy mają charakter przykładowy, a ich wskazanie ma na celu określenie oczekiwanego standardu, przy czym Zamawiający dopuszcza składanie ofert równoważnych w zakresie sporządzonego opisu przedmiotu zamówienia. 4) Przedmiot zamówienia określono poprzez wskazanie obiektywnych cech technicznych i jakościowych oraz standardów, dla których określenia dopuszcza się wskazanie przykładowych znaków towarowych. 5) W przypadku, gdy Zamawiający odnosi się w opisie przedmiotu zamówienia do norm, ocen technicznych, specyfikacji technicznych i systemów referencji technicznych, o których mowa w art. 101 ust.1 pkt 2 oraz ust.3 ustawy Pzp, dopuszcza się rozwiązania równoważne opisywanym. 6) Gwarancja i rękojmia - Okres gwarancji na wykonany przedmiot umowy – 60 miesięcy, licząc od daty podpisania końcowego protokołu zdawczo-odbiorczego bez zastrzeżeń. - Okres rękojmi za wady opracowanej przez Wykonawcę dokumentacji upływa z chwilą wygaśnięcia odpowiedzialności wszystkich Wykonawców robót budowlanych z tytułu ich rękojmi za wady robót przez nich zrealizowanych na podstawie dokumentacji będącej przedmiotem niniejszej umowy, lecz nie dłużej niż 5 lat od dnia upływu terminu gwarancji, o którym mowa w punkcie wyżej. - Niezależnie od uprawnień z tytułu rękojmi za wady przedmiotu umowy Zamawiającemu przysługuje prawo żądania od Wykonawcy naprawienia szkody powstałej wskutek nieosiągnięcia w zrealizowanych robotach parametrów zgodnych z normami i przepisami techniczno-budowlanymi. - Wykonawca odpowiada za wadę również po upływie okresu gwarancji lub rękojmi, jeżeli Zamawiający powiadomi Wykonawcę o wadzie przed upływem tych okresów."
