decision,priority_bucket,category,score,titre,acheteur,date_publication,date_limite,nature,type_marche,descripteurs,cpv_codes,departement,url,why,idweb
KEEP_HIGH,SECONDARY,ENGINEERING,16,Missions de maîtrise d'oeuvre pour la sécurisation des galeries souterraines sur le territoire de l'Eurométropole de Strasbourg,Eurométropole de Strasbourg,2026-03-15,2026-04-21T10:00:00+00:00,APPEL_OFFRE,SERVICES,Maîtrise d'oeuvre,71300000,67,https://www.boamp.fr/pages/avis/?q=idweb:26-26115,nature APPEL_OFFRE | type SERVICES | CPV secondaire 71300000 | + fort: maitrise d oeuvre,26-26115
KEEP_HIGH,CORE,AMO_PROGRAMMING,16,Marché d'assistance à maitrise d'ouvrage pour le renouvellement du contrat d'exploitation de l'unité de valorisation énergétique de l'Eurométropole de Strasbourg et la réflexion sur son devenir,Eurométropole de Strasbourg,2026-03-15,2026-05-19T10:00:00+00:00,APPEL_OFFRE,SERVICES,Assistance à maîtrise d'ouvrage,71313000,67,https://www.boamp.fr/pages/avis/?q=idweb:26-26083,nature APPEL_OFFRE | type SERVICES | CPV secondaire 71313000 | + fort: assistance a maitrise d ouvrage,26-26083
KEEP_HIGH,CORE,AMO_PROGRAMMING,16,Mandat de maitrise d'ouvrage pour le projet de reconstruction de l'EHPAD au CH de Vitry-le-François,CH Verdun Saint-Mihiel,2026-03-15,2026-04-27T10:00:00+00:00,APPEL_OFFRE,SERVICES,Assistance à maîtrise d'ouvrage,71310000,51 | 52 | 55,https://www.boamp.fr/pages/avis/?q=idweb:26-26454,nature APPEL_OFFRE | type SERVICES | CPV secondaire 71310000 | + fort: assistance a maitrise d ouvrage,26-26454
KEEP_HIGH,SECONDARY,ENGINEERING,16,Prestation de MOe : requalification des places PMF et Vohburg,Mairie de Clermont,2026-03-12,2026-04-09T12:00:00+00:00,APPEL_OFFRE,SERVICES,Maîtrise d'oeuvre,71300000,60 | 2,https://www.boamp.fr/pages/avis/?q=idweb:26-25617,nature APPEL_OFFRE | type SERVICES | CPV secondaire 71300000 | + fort: maitrise d oeuvre,26-25617
KEEP_HIGH,CORE,AMO_PROGRAMMING,16,Accord-cadre à bons de commande pour la réalisation de prestations de coordination sécurité et protection de la santé,PariSeine.spl,2026-03-11,2026-04-20T11:00:00+00:00,APPEL_OFFRE,SERVICES,Assistance à maîtrise d'ouvrage,71317210,75,https://www.boamp.fr/pages/avis/?q=idweb:26-24621,nature APPEL_OFFRE | type SERVICES | CPV secondaire 71317210 | + fort: assistance a maitrise d ouvrage,26-24621
KEEP_HIGH,SECONDARY,ENGINEERING,16,Mission de maitrise d’œuvre pour la réalisation des travaux du schéma directeur cyclable de la Communauté de communes Bassée-Montois,Communauté de communes Bassée Montois,2026-03-11,2026-04-29T17:00:00+00:00,APPEL_OFFRE,SERVICES,Maîtrise d'oeuvre,71300000,77,https://www.boamp.fr/pages/avis/?q=idweb:26-25099,nature APPEL_OFFRE | type SERVICES | CPV secondaire 71300000 | + fort: maitrise d oeuvre,26-25099
KEEP_HIGH,CORE,AMO_PROGRAMMING,16,CTR 26-001-01 - Mission d'Assistance projets Courant Faible pour les besoins du CASH de Nanterre et l'EPS Roger Prévot de Moisselles,CASH de Nanterre,2026-03-11,2026-04-13T11:00:00+00:00,APPEL_OFFRE,SERVICES,Electricité (travaux) | Assistance à maîtrise d'ouvrage,71318000,95,https://www.boamp.fr/pages/avis/?q=idweb:26-24347,nature APPEL_OFFRE | type SERVICES | CPV secondaire 71318000 | + fort: assistance a maitrise d ouvrage,26-24347
KEEP_HIGH,CORE,AMO_PROGRAMMING,16,Assistance à la maitrise d'ouvrage pour restructuration EHPAD,EHPAD LES EAUX VIVES,2026-03-11,2026-04-13T12:00:00+00:00,APPEL_OFFRE,SERVICES,Assistance à maîtrise d'ouvrage,71500000,23 | 87 | 19,https://www.boamp.fr/pages/avis/?q=idweb:26-24214,nature APPEL_OFFRE | type SERVICES | CPV secondaire 71500000 | + fort: assistance a maitrise d ouvrage,26-24214
KEEP_HIGH,SECONDARY,ENGINEERING,16,Caractérisation et cartographie des habitats naturels en milieu ouvert sur le site Natura 2000 n°FR2601016 du Bassin de la Grosne et du Clunisois,Communauté de Communes du Clunisois,2026-03-10,2026-04-29T12:00:00+00:00,APPEL_OFFRE,SERVICES,Etude,71351700 | 71354100 | 79311000 | 90700000,71,https://www.boamp.fr/pages/avis/?q=idweb:26-23883,nature APPEL_OFFRE | type SERVICES | CPV secondaire 71351700 | CPV secondaire 71354100 | + moyen: etude,26-23883
KEEP_HIGH,CORE,AMO_PROGRAMMING,16,"Réalisation de missions d'analyses financières, fiscales et prospectives pour la Région Réunion",Région Réunion,2026-03-10,2026-04-10T07:00:00+00:00,APPEL_OFFRE,SERVICES,Prestations de services,71241000,974,https://www.boamp.fr/pages/avis/?q=idweb:26-23766,nature APPEL_OFFRE | type SERVICES | CPV archi 71241000,26-23766
KEEP_HIGH,CORE,AMO_PROGRAMMING,16,Assistance technique pour la rénovation de toiture de bâtiment du Département du Finistère,Département du Finistère,2026-03-09,2026-04-01T16:00:00+00:00,APPEL_OFFRE,SERVICES,Assistance à maîtrise d'ouvrage,71315200,29,https://www.boamp.fr/pages/avis/?q=idweb:26-24171,nature APPEL_OFFRE | type SERVICES | CPV secondaire 71315200 | + fort: assistance a maitrise d ouvrage,26-24171
KEEP_HIGH,CORE,AMO_PROGRAMMING,16,Mission d'Assistance à Maîtrise d'Ouvrage pour les travaux de reconstruction de l'EHPAD Gaston Monmousseau,EHPAD Gaston Monmousseau,2026-03-07,2026-04-03T11:00:00+00:00,APPEL_OFFRE,SERVICES,Assistance à maîtrise d'ouvrage,71336000,93,https://www.boamp.fr/pages/avis/?q=idweb:26-23133,nature APPEL_OFFRE | type SERVICES | CPV secondaire 71336000 | + fort: assistance a maitrise d ouvrage,26-23133
KEEP_HIGH,CORE,AMO_PROGRAMMING,16,Missions de coordination en matière de sécurité et de protection de la santé pour le GHU,GHU  Psychiatrie et Neurosciences,2026-03-07,2026-04-08T12:00:00+00:00,APPEL_OFFRE,SERVICES,Assistance à maîtrise d'ouvrage,71317210,75 | 77 | 78 | 91,https://www.boamp.fr/pages/avis/?q=idweb:26-23106,nature APPEL_OFFRE | type SERVICES | CPV secondaire 71317210 | + fort: assistance a maitrise d ouvrage,26-23106
KEEP_HIGH,SECONDARY,ENGINEERING,16,Accord cadre de maîtrise d'oeuvre pour des travaux sur les réseaux d'eau potable et d'assainissement,Entre Bièvre et Rhône,2026-03-06,2026-04-07T10:00:00+00:00,APPEL_OFFRE,SERVICES,Maîtrise d'oeuvre,71330000,38,https://www.boamp.fr/pages/avis/?q=idweb:26-22490,nature APPEL_OFFRE | type SERVICES | CPV secondaire 71330000 | + fort: maitrise d oeuvre,26-22490
KEEP_HIGH,CORE,AMO_PROGRAMMING,16,Assistance A Maitrise D'Ouvrage - Chantier Des Collections Musees De Beziers,Mairie de Beziers,2026-03-06,2026-03-31T12:00:00+00:00,APPEL_OFFRE,SERVICES,Assistance à maîtrise d'ouvrage,71336000,34,https://www.boamp.fr/pages/avis/?q=idweb:26-23718,nature APPEL_OFFRE | type SERVICES | CPV secondaire 71336000 | + fort: assistance a maitrise d ouvrage,26-23718
KEEP_HIGH,SECONDARY,OTHER_RELEVANT,15,Marché de maitrise d'oeuvre pour la création d'une annexe judiciaire - CRA de Sete,Secrétariat Général pour l'Administration du Ministère de l'Intérieur Sud,2026-03-16,2026-04-10T12:00:00+00:00,APPEL_OFFRE,SERVICES,Maîtrise d'oeuvre,,34 | 30 | 48 | 12 | 81 | 11,https://www.boamp.fr/pages/avis/?q=idweb:26-27137,nature APPEL_OFFRE | type SERVICES | + fort: maitrise d oeuvre | + moyen: interieur,26-27137
KEEP_HIGH,SECONDARY,OTHER_RELEVANT,15,Marché de maîtrise d'oeuvre pour la création d'une annexe judiciaire - CRA de Nîmes,Secrétariat Général pour l'Administration du Ministère de l'Intérieur Sud,2026-03-16,2026-04-10T12:00:00+00:00,APPEL_OFFRE,SERVICES,Maîtrise d'oeuvre,,30 | 34 | 48 | 12 | 84 | 13,https://www.boamp.fr/pages/avis/?q=idweb:26-27138,nature APPEL_OFFRE | type SERVICES | + fort: maitrise d oeuvre | + moyen: interieur,26-27138
KEEP_HIGH,CORE,URBANISM_LANDSCAPE,15,Mission de Coordination en Matière de Sécurité et de Protection de la Santé (CSPS) pour la construction du nouveau siège INRIA,Etablissement public d'aménagement universitaire de la région Ile-de-France (Epaurif),2026-03-16,2026-04-07T12:00:00+00:00,APPEL_OFFRE,SERVICES,Sécurité incendie,71317210,75 | 78,https://www.boamp.fr/pages/avis/?q=idweb:26-26891,nature APPEL_OFFRE | type SERVICES | CPV secondaire 71317210 | + moyen: amenagement | + moyen: zac,26-26891
KEEP_HIGH,SECONDARY,ENGINEERING,15,"Réalisation de missions de Coordonnateur, Sécurité et Protection de la Santé sur le territoire de la communauté de communes entre Juine et Renarde",Communauté de communes Entre Juine et Renarde,2026-03-14,2026-04-14T10:00:00+00:00,APPEL_OFFRE,SERVICES,Ingénierie,71317210,91,https://www.boamp.fr/pages/avis/?q=idweb:26-25989,nature APPEL_OFFRE | type SERVICES | CPV secondaire 71317210 | + moyen: ingenierie | + moyen: batimentaire,26-25989
KEEP_HIGH,SECONDARY,ENGINEERING,15,Etude urbaine et habitat pour la définition d’un dispositif d’intervention pour l’amélioration de l’habitat sur les quartiers de Saint-Mauront Ouest et Butte Saint-Mauront,Métropole Aix-Marseille-Provence,2026-03-13,2026-03-31T10:30:00+00:00,APPEL_OFFRE,SERVICES,Etude,71000000,13,https://www.boamp.fr/pages/avis/?q=idweb:26-25526,nature APPEL_OFFRE | type SERVICES | CPV fort 71000000 | + moyen: etude de faisabilite | + moyen: etude | - fort: informatique,26-25526
KEEP_HIGH,SECONDARY,ENGINEERING,15,Etude du patrimoine - Schéma Directeur d'Alimentation en Eau Potable et PGSSE,Eaux de Vienne - SIVEER,2026-03-13,2026-05-15T10:00:00+00:00,APPEL_OFFRE,SERVICES,Etude | Ingénierie | Prestations de services,71335000,86,https://www.boamp.fr/pages/avis/?q=idweb:26-25454,nature APPEL_OFFRE | type SERVICES | CPV secondaire 71335000 | + moyen: etude | + moyen: ingenierie,26-25454
KEEP_HIGH,SECONDARY,ENGINEERING,15,Etudes de diagnostic de systèmes d'assainissement et élaboration de schémas directeurs d'assainissement,Eaux de Vienne - SIVEER,2026-03-13,2026-05-15T10:00:00+00:00,APPEL_OFFRE,SERVICES,Etude | Prestations de services | Ingénierie,71335000,86,https://www.boamp.fr/pages/avis/?q=idweb:26-25429,nature APPEL_OFFRE | type SERVICES | CPV secondaire 71335000 | + moyen: etude | + moyen: ingenierie,26-25429
KEEP_HIGH,SECONDARY,SURVEY_TOPO,15,Etudes préalables d'un système d'endiguement sur la commune de Gère-Bélesten,Communauté de Communes de la Vallée d Ossau,2026-03-13,2026-04-16T12:00:00+00:00,APPEL_OFFRE,SERVICES,Digue | Ouvrage hydraulique,71300000,64,https://www.boamp.fr/pages/avis/?q=idweb:26-26654,nature APPEL_OFFRE | type SERVICES | CPV secondaire 71300000 | + moyen: topographique | + moyen: etude,26-26654
KEEP_HIGH,SECONDARY,OTHER_RELEVANT,15,Marché de maîtrise d'oeuvre pour le renouvellement avec ou sans tranchée des réseaux d'eaux usées sur les communes de LOIREAUXENCE (VARADES) et COUFFE - 2 lots,Cté de Cnes du Pays d'Ancenis,2026-03-13,2026-04-17T12:00:00+00:00,APPEL_OFFRE,SERVICES,Réseaux divers | Assainissement,,44,https://www.boamp.fr/pages/avis/?q=idweb:26-26749,nature APPEL_OFFRE | type SERVICES | + fort: maitrise d oeuvre | + moyen: rehabilitation,26-26749
KEEP_HIGH,CORE,AMO_PROGRAMMING,15,PRESTATIONS DE PROPERTY MANAGEMENT SUR LES BIENS IMMOBILIERS BATIS,EPAMARNE,2026-03-12,2026-03-13T10:00:00+00:00,APPEL_OFFRE,SERVICES,Prestations de services,79993100 | 79994000,77,https://www.boamp.fr/pages/avis/?q=idweb:26-24818,nature APPEL_OFFRE | type SERVICES | + fort:  amo  | + moyen: amenagement,26-24818
KEEP_HIGH,SECONDARY,OTHER_RELEVANT,15,Marché de maîtrise d’œuvre pour la création d’une annexe judiciaire – CRA de Cornebarrieu,Secrétariat Général pour l'Administration du Ministère de l'Intérieur Sud,2026-03-12,2026-04-14T12:00:00+00:00,APPEL_OFFRE,SERVICES,Maîtrise d'oeuvre,,31,https://www.boamp.fr/pages/avis/?q=idweb:26-25597,nature APPEL_OFFRE | type SERVICES | + fort: maitrise d oeuvre | + moyen: interieur,26-25597
KEEP_HIGH,SECONDARY,ENGINEERING,15,"Construction, déconstruction et réaménagement du groupe scolaire Buisson à Brest (29)  
Mission d'ordonnancement, de pilotage et de coordination (OPC).",Ville de Brest,2026-03-12,2026-04-14T10:00:00+00:00,APPEL_OFFRE,SERVICES,Ingénierie,71300000,29,https://www.boamp.fr/pages/avis/?q=idweb:26-24966,nature APPEL_OFFRE | type SERVICES | CPV secondaire 71300000 | + moyen: amenagement | + moyen: ingenierie,26-24966
KEEP_HIGH,SECONDARY,ENGINEERING,15,Études et relevés naturalistes pour les opérations routières et autres dépendances du Département de Vaucluse,Département de Vaucluse,2026-03-12,2026-03-20T15:30:00+00:00,APPEL_OFFRE,SERVICES,Etude | Assistance technique,71313400,84,https://www.boamp.fr/pages/avis/?q=idweb:26-24941,nature APPEL_OFFRE | type SERVICES | CPV secondaire 71313400 | + moyen: amenagement | + moyen: etude,26-24941
KEEP_HIGH,SECONDARY,ENGINEERING,15,Ville de Dijon - Diagnostic sanitaire ancienne église Saint-Jean de Dijon,Ville de Dijon,2026-03-12,2026-04-02T12:00:00+00:00,APPEL_OFFRE,SERVICES,Etude | Maîtrise d'oeuvre,,21,https://www.boamp.fr/pages/avis/?q=idweb:26-25719,nature APPEL_OFFRE | type SERVICES | + fort: maitrise d oeuvre | + moyen: etude,26-25719
KEEP_HIGH,CORE,URBANISM_LANDSCAPE,15,Plan de sauvegarde #1 de la Résidence d'Essert - Syndicat principal - Elaboration et accompagnement,Communauté d'Agglomération Grand Belfort,2026-03-12,2026-04-13T10:00:00+00:00,APPEL_OFFRE,SERVICES,Etude | Prestations de services,71410000,90 | 21 | 25 | 67 | 68 | 70,https://www.boamp.fr/pages/avis/?q=idweb:26-24998,nature APPEL_OFFRE | type SERVICES | CPV archi 71410000 | + moyen: etude | - moyen: accompagnement,26-24998
KEEP_HIGH,SECONDARY,ENGINEERING,15,Réalisation d’études de restauration de la continuité écologique et réduction de la vulnérabilité aux inondations sur les bassins versants de la Sélune et de la Sée,Communauté d'Agglomération Mont Saint-Michel Normandie,2026-03-12,2026-04-27T10:00:00+00:00,APPEL_OFFRE,SERVICES,Etude | Ingénierie,71313000,50,https://www.boamp.fr/pages/avis/?q=idweb:26-24680,nature APPEL_OFFRE | type SERVICES | CPV secondaire 71313000 | + moyen: etude | + moyen: ingenierie,26-24680
KEEP_HIGH,SECONDARY,OTHER_RELEVANT,15,Marché de maîtrise d’œuvre pour la création d’une annexe judiciaire – CRA de Perpignan,Secrétariat Général pour l'Administration du Ministère de l'Intérieur Sud,2026-03-12,2026-04-07T12:00:00+00:00,APPEL_OFFRE,SERVICES,Maîtrise d'oeuvre,,66,https://www.boamp.fr/pages/avis/?q=idweb:26-25696,nature APPEL_OFFRE | type SERVICES | + fort: maitrise d oeuvre | + moyen: interieur,26-25696
KEEP_HIGH,CORE,AMO_PROGRAMMING,15,Suivi animation du dispositif OPAH RU multisites,Communauté de Communes du Pays Foyen,2026-03-12,2026-04-20T12:00:00+00:00,APPEL_OFFRE,SERVICES,Etude,71241000,33,https://www.boamp.fr/pages/avis/?q=idweb:26-25914,nature APPEL_OFFRE | type SERVICES | CPV archi 71241000 | + moyen: etude | - moyen: animation,26-25914
KEEP_HIGH,CORE,URBANISM_LANDSCAPE,15,ZAC PYTHON DUVERNOIS - Mission de CSPS pour la construction d'un équipements multisports et l'aménagement de ses abords,SEMAPA,2026-03-11,2026-04-09T12:00:00+00:00,APPEL_OFFRE,SERVICES,Equipement sportif,71317210,75,https://www.boamp.fr/pages/avis/?q=idweb:26-25132,nature APPEL_OFFRE | type SERVICES | CPV secondaire 71317210 | + moyen: amenagement | + moyen: zac,26-25132
KEEP_HIGH,CORE,AMO_PROGRAMMING,15,"Assistance juridique, technique et financière dans le choix du mode de gestion du service public de l’eau industrielle sur le territoire du SED et le cas échéant dans la procédure de DSP",SYNDICAT DE L'EAU DU DUNKERQUOIS,2026-03-11,2026-04-08T11:00:00+00:00,APPEL_OFFRE,SERVICES,Assistance juridique | Audit | Ingénierie,71241000,59 | 62,https://www.boamp.fr/pages/avis/?q=idweb:26-25090,nature APPEL_OFFRE | type SERVICES | CPV archi 71241000 | + moyen: ingenierie | - moyen: accompagnement,26-25090
KEEP_HIGH,SECONDARY,ENGINEERING,15,Prestations d'assistance technique pour des études mécaniques,SYNCHROTRON SOLEIL,2026-03-11,2026-04-13T15:00:00+00:00,APPEL_OFFRE,SERVICES,Assistance technique,71333000,91,https://www.boamp.fr/pages/avis/?q=idweb:26-24614,nature APPEL_OFFRE | type SERVICES | CPV secondaire 71333000 | + moyen: etude | + moyen: ingenierie,26-24614
KEEP_HIGH,CORE,AMO_PROGRAMMING,15,"Mission d'Assistance à Maître d'Ouvrage pour la réhabilitation de 120 logements 18-20-22, rue de la Pelouse à 25000 - Besançon",Loge.GBM (25),2026-03-11,2026-04-02T17:00:00+00:00,APPEL_OFFRE,SERVICES,Assistance à maîtrise d'ouvrage,,25,https://www.boamp.fr/pages/avis/?q=idweb:26-25364,nature APPEL_OFFRE | type SERVICES | + fort: assistance a maitrise d ouvrage | + moyen: rehabilitation,26-25364
KEEP_HIGH,SECONDARY,ENGINEERING,15,Conseil à maîtrise d’ouvrage pour la libération des emprises foncières et le suivi des procédures DUP sur le réseau de la DIR Massif-Central concerné ou non par la loi de décentralisation 3DS.,DIR MASSIF CENTRAL,2026-03-10,2026-04-20T09:00:00+00:00,APPEL_OFFRE,SERVICES,Assistance juridique | Etude | Ingénierie | Prestations de services,71336000,7 | 12 | 15 | 34 | 43 | 48 | 63,https://www.boamp.fr/pages/avis/?q=idweb:26-23870,nature APPEL_OFFRE | type SERVICES | CPV secondaire 71336000 | + moyen: etude | + moyen: ingenierie,26-23870
KEEP_HIGH,SECONDARY,OTHER_RELEVANT,15,Maitrise d'œuvre relative à l'aménagement d'une Maison du don (MDD) à Marseille,EFS PACA-Corse,2026-03-10,2026-03-30T12:00:00+00:00,APPEL_OFFRE,SERVICES,Maîtrise d'oeuvre,,13,https://www.boamp.fr/pages/avis/?q=idweb:26-24626,nature APPEL_OFFRE | type SERVICES | + fort: maitrise d oeuvre | + moyen: amenagement,26-24626
KEEP_HIGH,SECONDARY,ENGINEERING,15,Etude de potentiel de déraccordement,Communauté de communes de la région de Molsheim-Mutzig,2026-03-10,2026-04-10T12:00:00+00:00,APPEL_OFFRE,SERVICES,Ingénierie,71313000,67,https://www.boamp.fr/pages/avis/?q=idweb:26-24633,nature APPEL_OFFRE | type SERVICES | CPV secondaire 71313000 | + moyen: etude | + moyen: ingenierie,26-24633
KEEP_HIGH,SECONDARY,OTHER_RELEVANT,15,Maîtrise d'oeuvre - Travaux d'aménagement de l'espace balnéo et d'un vestiaire fitness au complexe HELICEA,Communauté d'agglomération du Boulonnais,2026-03-10,2026-04-09T12:00:00+00:00,APPEL_OFFRE,SERVICES,Maîtrise d'oeuvre,,62,https://www.boamp.fr/pages/avis/?q=idweb:26-24882,nature APPEL_OFFRE | type SERVICES | + fort: maitrise d oeuvre | + moyen: amenagement,26-24882
KEEP_HIGH,CORE,ARCHITECTURE_BUILDING,15,Diagnostics de vulnérabilité des bâtiments en zone inondable.,Menelik EPAGE,2026-03-09,2026-04-20T12:00:00+00:00,APPEL_OFFRE,SERVICES,Etude,71241000,13 | 83,https://www.boamp.fr/pages/avis/?q=idweb:26-23911,nature APPEL_OFFRE | type SERVICES | CPV archi 71241000 | + moyen: etude | - moyen: animation,26-23911
KEEP_HIGH,CORE,COMPETITIONS,15,26V0409 - Restructuration et extension du stade des Arboras - Concours de maîtrise d'oeuvre restreint,VILLE DE NICE,2026-03-08,,APPEL_OFFRE,SERVICES,Maîtrise d'oeuvre,71000000,6,https://www.boamp.fr/pages/avis/?q=idweb:26-23661,nature APPEL_OFFRE | type SERVICES | CPV fort 71000000 | + fort: maitrise d oeuvre | + fort: mission de maitrise d oeuvre | + fort: architecte | + fort: architecture | + fort: concours d architecture | + fort: concours de maitrise d oeuvre | + moyen: amenagement,26-23661
KEEP_HIGH,SECONDARY,ENGINEERING,15,Observatoire permanent des publics et comité de visiteurs,Cité de l'architecture et du patrimoin,2026-03-06,2026-04-07T11:00:00+00:00,APPEL_OFFRE,SERVICES,"Sondage, enquête",,75 | 77 | 78 | 91 | 92 | 93 | 94 | 95,https://www.boamp.fr/pages/avis/?q=idweb:26-23712,nature APPEL_OFFRE | type SERVICES | + fort: architecture | + moyen: etude,26-23712
KEEP_HIGH,SECONDARY,ENGINEERING,15,ETUDES ET DIAGNOSTICS GEOTECHNIQUES,LIMOGES METROPOLE - Communauté urbaine,2026-03-06,2026-04-08T11:00:00+00:00,APPEL_OFFRE,SERVICES,Etude,71332000 | 71630000,87,https://www.boamp.fr/pages/avis/?q=idweb:26-22489,nature APPEL_OFFRE | type SERVICES | CPV secondaire 71332000 | + moyen: etude | + moyen: ingenierie,26-22489
KEEP_HIGH,SECONDARY,ENGINEERING,15,33 - Mérignac - BA 106 - Mandat de Maîtrise d'Ouvrage - Réhabilitation des bâtiments LC3 et LC4 - Phase candidatures,SID SUD OUEST,2026-03-06,,APPEL_OFFRE,SERVICES,Ingénierie,71330000,33,https://www.boamp.fr/pages/avis/?q=idweb:26-22624,nature APPEL_OFFRE | type SERVICES | CPV secondaire 71330000 | + moyen: rehabilitation | + moyen: ingenierie,26-22624
KEEP_HIGH,SECONDARY,ENGINEERING,15,Réalisation de missions de prestations Sites et Sols Pollués en vue de la cessation d'activité de 6 déchèteries,Mauges Communauté,2026-03-06,2026-04-10T12:00:00+00:00,APPEL_OFFRE,SERVICES,Déchetterie (exploitation) | Etude | Ingénierie,71351500,49,https://www.boamp.fr/pages/avis/?q=idweb:26-23401,nature APPEL_OFFRE | type SERVICES | CPV secondaire 71351500 | + moyen: etude | + moyen: ingenierie,26-23401
KEEP_HIGH,SECONDARY,ENGINEERING,15,"Mise à jour de l'étude diagnostique des réseaux et ouvrages, Etablissement d'un Schéma Directeur d'Assainissement",Syndicat Mixte Contrat Rivière Woigot,2026-03-06,,APPEL_OFFRE,SERVICES,Assainissement | Etude | Réseaux divers,71335000 | 71631000 | 79311200,54,https://www.boamp.fr/pages/avis/?q=idweb:26-22805,nature APPEL_OFFRE | type SERVICES | CPV secondaire 71335000 | + moyen: amenagement | + moyen: etude,26-22805
KEEP_HIGH,SECONDARY,ENGINEERING,15,mise à jour du schéma directeur d'alimentation en eau potable de la Communauté d'Agglomération du Centre Littoral,Communauté d'Agglomération du Centre Littoral de Matoury (973),2026-03-05,2026-03-23T15:00:00+00:00,APPEL_OFFRE,SERVICES,Etude | Ingénierie,71300000,973,https://www.boamp.fr/pages/avis/?q=idweb:26-22064,nature APPEL_OFFRE | type SERVICES | CPV secondaire 71300000 | + moyen: etude | + moyen: ingenierie,26-22064
KEEP_HIGH,SECONDARY,OTHER_RELEVANT,15,MAÎTRISE D’ŒUVRE POUR L’AMENAGEMENT EXTERIEUR DE LA PISCINE AQUAVALLÉE  ABORD ET ESPACE VERT A ISOLA VILLAGE,Commune d'Isola (06),2026-03-05,,APPEL_OFFRE,SERVICES,Maîtrise d'oeuvre,,6,https://www.boamp.fr/pages/avis/?q=idweb:26-22882,nature APPEL_OFFRE | type SERVICES | + fort: maitrise d oeuvre | + moyen: amenagement,26-22882
KEEP_HIGH,SECONDARY,ENGINEERING,15,Mission de diagnostic de la structure pour l'opération de réhabilitation et de mise en conformité de la maison cantonnière de la Rothlach au Champ du Feu,Collectivité européenne d'Alsace,2026-03-05,2026-03-27T12:00:00+00:00,APPEL_OFFRE,SERVICES,Etude | Prestations de services,71335000,67 | 68,https://www.boamp.fr/pages/avis/?q=idweb:26-22790,nature APPEL_OFFRE | type SERVICES | CPV secondaire 71335000 | + moyen: rehabilitation | + moyen: etude,26-22790
KEEP_HIGH,SECONDARY,OTHER_RELEVANT,15,MAÎTRISE D’OEUVRE POUR L’AMENAGEMENT EXTERIEUR DE LA PISCINE AQUAVALLÉE ABORD ET ESPACE VERT A ISOLA VILLAGE,Commune d'Isola (06),2026-03-05,,APPEL_OFFRE,SERVICES,Maîtrise d'oeuvre,,6,https://www.boamp.fr/pages/avis/?q=idweb:26-22892,nature APPEL_OFFRE | type SERVICES | + fort: maitrise d oeuvre | + moyen: amenagement,26-22892
KEEP_HIGH,SECONDARY,ENGINEERING,15,Fouilles Archeologiques Dans Le Cadre Des Travaux De Rehabilitation Du Cloitre Et De Ses Abords A L'Abbaye De L'Escaladieu,Département des Hautes Pyrénées,2026-03-05,2026-03-30T12:00:00+00:00,APPEL_OFFRE,SERVICES,Prestations de services | Fouille archéologique,71351914,65,https://www.boamp.fr/pages/avis/?q=idweb:26-22820,nature APPEL_OFFRE | type SERVICES | CPV secondaire 71351914 | + moyen: rehabilitation | + moyen: etude,26-22820
KEEP_HIGH,SECONDARY,SURVEY_TOPO,14,MISSION DE GÉOMÈTRE-EXPERT POUR LA RÉALISATION D’UNE CAMPAGNE DE  REPÉRAGE DE RÉSEAUX ENTERRÉS ET RAPPORT DE PRÉCONISATIONS,ENSM.,2026-03-16,2026-04-15T12:00:00+00:00,APPEL_OFFRE,SERVICES,Topographie,,13,https://www.boamp.fr/pages/avis/?q=idweb:26-27241,nature APPEL_OFFRE | type SERVICES | + moyen: topographie | + moyen: geometre | + moyen: geometre expert,26-27241
KEEP_HIGH,CORE,ARCHITECTURE_BUILDING,14,"Prestations de MOE en vue de la Réalisation d’ouvrages de gestion alternative des eaux pluviales et de refonctionnalisation des sols (désimperméabilisation, renaturation) - Site Cerema de TRAPPES",CEREMA,2026-03-14,,EX_ANTE_VOLONTAIRE,SERVICES,Maîtrise d'oeuvre,71000000,78 | 69,https://www.boamp.fr/pages/avis/?q=idweb:26-25894,nature non ideale: EX_ANTE_VOLONTAIRE | type SERVICES | CPV fort 71000000 | + fort: maitrise d oeuvre,26-25894
KEEP_HIGH,SECONDARY,ENGINEERING,14,Etude de conception de la signalétique et des aménagements des futurs sentiers de l'ENS DU RUISSEAU DU RAVIN,Ville de Fontaines-sur-Saone,2026-03-12,2026-04-13T12:00:00+00:00,APPEL_OFFRE,SERVICES,Etude,,69,https://www.boamp.fr/pages/avis/?q=idweb:26-25740,nature APPEL_OFFRE | type SERVICES | + moyen: amenagement | + moyen: etude | + moyen: signaletique,26-25740
KEEP_HIGH,CORE,ARCHITECTURE_BUILDING,14,Mission de maîtrise d’œuvre complète pour la fourniture et l’installation de groupes électrogènes sur le réseau d’eau potable de la CASUD,COMMUNAUTE D'AGGLOMERATION DU SUD,2026-03-12,2026-04-14T12:00:00+00:00,APPEL_OFFRE,SERVICES,Maîtrise d'oeuvre,71240000,974,https://www.boamp.fr/pages/avis/?q=idweb:26-25732,nature APPEL_OFFRE | type SERVICES | CPV archi 71240000 | + fort: maitrise d oeuvre | - fort: fourniture,26-25732
KEEP_HIGH,CORE,AMO_PROGRAMMING,14,2026-12EP MISSION DE PROGRAMMATION POUR LES TRAVAUX DE RESTRUCTURATION ET D'AMENAGEMENT DU STADE PAUL CHANDON-.,Ville d'Epernay,2026-03-12,2026-04-08T12:00:00+00:00,APPEL_OFFRE,SERVICES,Prestations de services,,51,https://www.boamp.fr/pages/avis/?q=idweb:26-25776,nature APPEL_OFFRE | type SERVICES | + moyen: amenagement | + moyen: etude de faisabilite | + moyen: etude,26-25776
KEEP_HIGH,CORE,ARCHITECTURE_BUILDING,14,"Mission d'Ordonnancement, de Pilotage et de Coordination (OPC) relative à la 1ère phase de requalification des espaces publics de la Cité 10 à Sains en Gohelle - Secteur Sud de l'avenue du Prince",Communauté d' Agglomération de Lens Lievin,2026-03-08,2026-04-09T10:00:00+00:00,APPEL_OFFRE,SERVICES,Maîtrise d'oeuvre,71247000,62 | 59,https://www.boamp.fr/pages/avis/?q=idweb:26-23276,nature APPEL_OFFRE | type SERVICES | CPV archi 71247000 | + fort: maitrise d oeuvre | - fort: informatique,26-23276
