decision,priority_bucket,category,score,titre,acheteur,date_publication,date_limite,nature,type_marche,descripteurs,cpv_codes,departement,url,why,idweb
KEEP_HIGH,CORE,ARCHITECTURE_BUILDING,14,"Mission d'Ordonnancement, de Pilotage et de Coordination (OPC) relative à la requalification des espaces publics de la cité 4 à LENS (62)",Communauté d' Agglomération de Lens Lievin,2026-03-06,2026-04-07T10:00:00+00:00,APPEL_OFFRE,SERVICES,Maîtrise d'oeuvre,71247000,62 | 59,https://www.boamp.fr/pages/avis/?q=idweb:26-22774,nature APPEL_OFFRE | type SERVICES | CPV archi 71247000 | + fort: maitrise d oeuvre | - fort: informatique,26-22774
KEEP_MEDIUM,SECONDARY,ENGINEERING,13,Elaboration de la SPRE des captages de Blangy sur Bresle ainsi que pour les PGSSE (zone de captage et production/distribution) et le diagnostic eau potable du système du SIAEPA de Blangy-Bouttencourt.,SIAEPA de BLANGY-BOUTTENCOURT,2026-03-17,2026-05-15T12:00:00+00:00,APPEL_OFFRE,SERVICES,Alimentation en eau potable | Captage | Etude,71330000,27 | 76 | 80,https://www.boamp.fr/pages/avis/?q=idweb:26-27452,nature APPEL_OFFRE | type SERVICES | CPV secondaire 71330000 | + moyen: etude,26-27452
KEEP_MEDIUM,SECONDARY,ENGINEERING,13,"RÉHABILITATION LOURDE ET EXTENSION DE LA CRÈCHE ROBERT LEBON - Mission d’ordonnancement, de Pilotage et de Coordination (OPC)",Mairie de Villejuif,2026-03-17,2026-04-07T11:00:00+00:00,APPEL_OFFRE,SERVICES,"Mission d'ordonnancement, pilotage, coordination (OPC)",71521000,94,https://www.boamp.fr/pages/avis/?q=idweb:26-27598,nature APPEL_OFFRE | type SERVICES | CPV secondaire 71521000 | + moyen: rehabilitation,26-27598
KEEP_MEDIUM,SECONDARY,OTHER_RELEVANT,13,MAITRISE D’OEUVRE POUR LA RENOVATION DES TOITURES DE BÂTIMENTS D’ELEVAGE – Ferme expérimentale de la Bouzule,Université de Lorraine-DPI-SDPI,2026-03-17,2026-04-24T17:30:00+00:00,APPEL_OFFRE,SERVICES,Maîtrise d'oeuvre,,54,https://www.boamp.fr/pages/avis/?q=idweb:26-27903,nature APPEL_OFFRE | type SERVICES | + fort: maitrise d oeuvre,26-27903
KEEP_MEDIUM,CORE,AMO_PROGRAMMING,13,mission d’Assistance à maîtrise d’ouvrage pour la relance du marché assurances de la CCMPM pour la période 2027-2030,Communauté de Communes Méditerranée Porte des Maures (83),2026-03-17,2026-04-08T12:00:00+00:00,APPEL_OFFRE,SERVICES,Assistance à maîtrise d'ouvrage | Assurance,66519310,83,https://www.boamp.fr/pages/avis/?q=idweb:26-27858,nature APPEL_OFFRE | type SERVICES | + fort: assistance a maitrise d ouvrage,26-27858
KEEP_MEDIUM,CORE,AMO_PROGRAMMING,13,"Assistance à Maîtrise d'Ouvrage Technique, Environnementale et missions de Commissionnement (AMOTEC) dans le cadre de la restructuration de la ROCK-SCHOOL BARBEY à Bordeaux",Ville de Bordeaux,2026-03-17,2026-03-30T14:00:00+00:00,APPEL_OFFRE,SERVICES,Assistance à maîtrise d'ouvrage,90700000,33,https://www.boamp.fr/pages/avis/?q=idweb:26-26899,nature APPEL_OFFRE | type SERVICES | + fort: assistance a maitrise d ouvrage,26-26899
KEEP_MEDIUM,SECONDARY,OTHER_RELEVANT,13,Maîtrise d'oeuvre relative aux travaux d'optimisation des usines de production d'eau potable de La Gauberdière et de La Taute,Syndicat Départemental de l'eau de la Manche,2026-03-17,2026-04-13T12:00:00+00:00,APPEL_OFFRE,SERVICES,Maîtrise d'oeuvre | Prestations de services,,50,https://www.boamp.fr/pages/avis/?q=idweb:26-27797,nature APPEL_OFFRE | type SERVICES | + fort: maitrise d oeuvre,26-27797
KEEP_MEDIUM,SECONDARY,OTHER_RELEVANT,13,Prestations de maîtrise d’œuvre pour les travaux de raccordement du Conseil constitutionnel au réseau Fraîcheur de Paris,Conseil constitutionnel,2026-03-17,2026-04-13T12:00:00+00:00,APPEL_OFFRE,SERVICES,Maîtrise d'oeuvre,,75,https://www.boamp.fr/pages/avis/?q=idweb:26-27626,nature APPEL_OFFRE | type SERVICES | + fort: maitrise d oeuvre,26-27626
KEEP_MEDIUM,SECONDARY,OTHER_RELEVANT,13,MARCHE POUR LES CLASSES DE DECOUVERTES 2026/2030 /SEJOURS DE VACANCES 2026 - 2030,Ville de Roubaix,2026-03-16,2026-04-14T10:00:00+00:00,APPEL_OFFRE,SERVICES,Prestations de services | Voyage,55240000,59,https://www.boamp.fr/pages/avis/?q=idweb:26-26823,nature APPEL_OFFRE | type SERVICES | + fort: architecture,26-26823
KEEP_MEDIUM,SECONDARY,ENGINEERING,13,Mission de contrôle technique relative à l’aménagement d’un espace d’environ 410 m² situé au rez-de-chaussée du site de la Direction Départementale de l’Education Nationale du Gard (DSDEN 30),Région académique Occitanie,2026-03-16,2026-04-13T12:00:00+00:00,APPEL_OFFRE,SERVICES,Prestations de services,71300000,30 | 34,https://www.boamp.fr/pages/avis/?q=idweb:26-27094,nature APPEL_OFFRE | type SERVICES | CPV secondaire 71300000 | + moyen: amenagement,26-27094
KEEP_MEDIUM,SECONDARY,ENGINEERING,13,Mission de contrôle technique relative à l’aménagement d’un espace d’environ 410 m² situé au rez-de-chaussée du site de la Direction Départementale de l’Education Nationale du Gard (DSDEN 30),Région académique Occitanie,2026-03-16,2026-04-13T12:00:00+00:00,APPEL_OFFRE,SERVICES,Prestations de services,71300000,30 | 34,https://www.boamp.fr/pages/avis/?q=idweb:26-27078,nature APPEL_OFFRE | type SERVICES | CPV secondaire 71300000 | + moyen: amenagement,26-27078
KEEP_MEDIUM,SECONDARY,ENGINEERING,13,Mission de Coordonnateur SPS relative à l’aménagement d’un espace d’environ 410 m² situé au rez-de-chaussée du site de la Direction Départementale de l’Education Nationale du Gard (DSDEN 30),Région académique Occitanie,2026-03-16,2026-04-13T12:00:00+00:00,APPEL_OFFRE,SERVICES,Prestations de services,71300000,30 | 34,https://www.boamp.fr/pages/avis/?q=idweb:26-27079,nature APPEL_OFFRE | type SERVICES | CPV secondaire 71300000 | + moyen: amenagement,26-27079
KEEP_MEDIUM,CORE,AMO_PROGRAMMING,13,Mission d'assistance à maitrise d'ouvrage relative au suivi et contrôle,Intercom Bernay Terres de Normandie,2026-03-16,2026-04-17T16:00:00+00:00,APPEL_OFFRE,SERVICES,Assistance à maîtrise d'ouvrage,,27,https://www.boamp.fr/pages/avis/?q=idweb:26-27317,nature APPEL_OFFRE | type SERVICES | + fort: assistance a maitrise d ouvrage,26-27317
KEEP_MEDIUM,SECONDARY,ENGINEERING,13,Finalisation de la révision du Schéma de Cohérence Territoriale du Cambrésis,Syndicat Mixte du Pôle d’Équilibre Territorial et Rural du Pays du Cambrésis,2026-03-16,2026-04-30T12:00:00+00:00,APPEL_OFFRE,SERVICES,Etude,71300000,59,https://www.boamp.fr/pages/avis/?q=idweb:26-27290,nature APPEL_OFFRE | type SERVICES | CPV secondaire 71300000 | + moyen: etude,26-27290
KEEP_MEDIUM,SECONDARY,ENGINEERING,13,Schéma directeur d'assainissement eaux usées : systèmes d'assainissement des eaux usées de Torigny-les-Villes,Saint-Lô Agglo,2026-03-15,2026-04-21T10:00:00+00:00,APPEL_OFFRE,SERVICES,Etude,71335000,50,https://www.boamp.fr/pages/avis/?q=idweb:26-26699,nature APPEL_OFFRE | type SERVICES | CPV secondaire 71335000 | + moyen: etude,26-26699
KEEP_MEDIUM,CORE,URBANISM_LANDSCAPE,13,Accord-cadre de missions de coordination en matière de sécurité et de protection de la santé sur les sites et ouvrages d'Eau de Paris,EAU DE PARIS,2026-03-15,2026-04-16T10:00:00+00:00,APPEL_OFFRE,SERVICES,Prestations de services,71317210,75,https://www.boamp.fr/pages/avis/?q=idweb:26-26790,nature APPEL_OFFRE | type SERVICES | CPV secondaire 71317210 | + moyen: espace public,26-26790
KEEP_MEDIUM,SECONDARY,ENGINEERING,13,"Réalisation d'inventaires naturalistes, d'études techniques et réglementaires pour l'amélioration de la connaissance scientifique et du fonctionnement écologique sur les propriétés départementales - 4",Conseil Départemental du Nord,2026-03-15,2026-04-15T14:30:00+00:00,APPEL_OFFRE,SERVICES,Etude,71300000,59,https://www.boamp.fr/pages/avis/?q=idweb:26-26553,nature APPEL_OFFRE | type SERVICES | CPV secondaire 71300000 | + moyen: etude,26-26553
KEEP_MEDIUM,CORE,AMO_PROGRAMMING,13,Déconstruction du bateau-pompe Louis COLET et de ses prestations associées,GRAND PORT MARITIME DE MARSEILLE,2026-03-14,2026-03-31T10:00:00+00:00,APPEL_OFFRE,SERVICES,Démolition,50243000,13,https://www.boamp.fr/pages/avis/?q=idweb:26-25954,nature APPEL_OFFRE | type SERVICES | + fort:  amo ,26-25954
KEEP_MEDIUM,SECONDARY,ENGINEERING,13,Mission de maitrise d'œuvre pour la mise en conformité des tunnels cours La Reine (8ème) et Citroën Cévennes (15ème),VILLE de PARIS - DFA - SDA,2026-03-14,2026-04-28T11:00:00+00:00,APPEL_OFFRE,SERVICES,Etude,71322000,75,https://www.boamp.fr/pages/avis/?q=idweb:26-25937,nature APPEL_OFFRE | type SERVICES | CPV secondaire 71322000 | + moyen: etude,26-25937
KEEP_MEDIUM,SECONDARY,ENGINEERING,13,Diagnostic des éléments structurels porteurs de la terrasse administration du Palais de Tokyo,OPPIC,2026-03-13,2026-04-16T12:00:00+00:00,APPEL_OFFRE,SERVICES,Bâtiment | Ingénierie,71315300,75 | 77 | 78 | 91 | 92 | 93 | 94 | 95,https://www.boamp.fr/pages/avis/?q=idweb:26-26769,nature APPEL_OFFRE | type SERVICES | CPV secondaire 71315300 | + moyen: ingenierie,26-26769
KEEP_MEDIUM,CORE,AMO_PROGRAMMING,13,Mission d’assistance à maîtrise d’ouvrage pour l’évaluation du contrat de concession de transport urbain sur le territoire de la CANGT et l’accompagnement au renouvellement du contrat de concession,CANGT,2026-03-13,2026-04-20T12:00:00+00:00,APPEL_OFFRE,SERVICES,Assistance à maîtrise d'ouvrage | Transport,71311200,971,https://www.boamp.fr/pages/avis/?q=idweb:26-26799,nature APPEL_OFFRE | type SERVICES | CPV secondaire 71311200 | + fort: assistance a maitrise d ouvrage | - moyen: accompagnement,26-26799
KEEP_MEDIUM,SECONDARY,ENGINEERING,13,"Audits énergétiques globaux sur le patrimoine bâti des collectivités
locales de l'Oise",Syndicat d'Energie de l'Oise SE60,2026-03-13,2026-04-17T12:00:00+00:00,APPEL_OFFRE,SERVICES,Audit | Etude,71314300,60 | 80,https://www.boamp.fr/pages/avis/?q=idweb:26-26489,nature APPEL_OFFRE | type SERVICES | CPV secondaire 71314300 | + moyen: etude,26-26489
KEEP_MEDIUM,CORE,AMO_PROGRAMMING,13,25sa47 - Mission d'Amo pour l'accompagnement à la valorisation des Certificats d'Economie d'Energie,Communauté  d'Agglomération de Cergy-Pontoise,2026-03-13,2026-04-17T12:00:00+00:00,APPEL_OFFRE,SERVICES,Prestations de services,71313000,95,https://www.boamp.fr/pages/avis/?q=idweb:26-26810,nature APPEL_OFFRE | type SERVICES | CPV secondaire 71313000 | + fort:  amo  | - moyen: accompagnement,26-26810
KEEP_MEDIUM,SECONDARY,OTHER_RELEVANT,13,Mission de maîtrise d'uvre pour la réalisation des travaux de doublement du forage Longeville Nord « Rocha » afin de sécuriser la production d'eau potable de l'Unité de Distribution de Tronville,COMMUNAUTE D'AGGLOMERATION BAR LE DUC SUD MEUSE,2026-03-13,2026-04-10T12:00:00+00:00,APPEL_OFFRE,SERVICES,Maîtrise d'oeuvre | Forage,,55 | 8 | 10 | 51,https://www.boamp.fr/pages/avis/?q=idweb:26-26575,nature APPEL_OFFRE | type SERVICES | + fort: maitrise d oeuvre,26-26575
KEEP_MEDIUM,SECONDARY,OTHER_RELEVANT,13,Maîtrise d'oeuvre pour le renforcement structurel du sous-sol de la papèterie de Montech,MAIRIE DE MONTECH,2026-03-12,2026-04-17T12:00:00+00:00,APPEL_OFFRE,SERVICES,Maîtrise d'oeuvre,,82,https://www.boamp.fr/pages/avis/?q=idweb:26-25718,nature APPEL_OFFRE | type SERVICES | + fort: maitrise d oeuvre,26-25718
KEEP_MEDIUM,SECONDARY,ENGINEERING,13,"Assistance à la maitrise d’ouvrage BIM pour le projet de construction de la cuisine St Antoine de Palanque, boulevard du Bosphore, 13015 Marseille.",Ville de Marseille,2026-03-12,2026-04-01T16:00:00+00:00,APPEL_OFFRE,SERVICES,Ingénierie,71312000,13,https://www.boamp.fr/pages/avis/?q=idweb:26-25769,nature APPEL_OFFRE | type SERVICES | CPV secondaire 71312000 | + moyen: ingenierie,26-25769
KEEP_MEDIUM,SECONDARY,ENGINEERING,13,"BOULEVARD DE LA CITE, RUE NEUVE SAINT-ETIENNE ET RUE DU MAUPAS A LIMOGES FOUILLES ARCHEOLOGIQUES DU CHANTIER DE REAMENAGEMENT DE LA VOIE (ASSAINISSEMENT, EAU POTABLE, EFFACEMENT DE RESEAUX, VOIRIE, TR",LIMOGES METROPOLE - Communauté urbaine,2026-03-12,2026-04-20T11:00:00+00:00,APPEL_OFFRE,SERVICES,Fouille archéologique,45112450 | 71351914,87,https://www.boamp.fr/pages/avis/?q=idweb:26-24753,nature APPEL_OFFRE | type SERVICES | CPV secondaire 71351914 | + moyen: amenagement,26-24753
KEEP_MEDIUM,SECONDARY,ENGINEERING,13,MISSION D'ASSITANCE A MAITRISE D'OUVRAGE POUR LA SECURISATION QUALITATIVE DE L'EAU DESTINEE A LA CONSOMMATION HUMAINE DE L'UNITE DE DISTRIBUTION DE MONTREUIL SUR MER,CA2BM - Communauté d&#039;Agglomération des deux Baies en Montreuillois,2026-03-12,2026-04-15T12:00:00+00:00,APPEL_OFFRE,SERVICES,Alimentation en eau potable | Etude,71310000,62,https://www.boamp.fr/pages/avis/?q=idweb:26-25798,nature APPEL_OFFRE | type SERVICES | CPV secondaire 71310000 | + moyen: etude,26-25798
KEEP_MEDIUM,CORE,AMO_PROGRAMMING,13,Assistance à Maîtrise d’Ouvrage pour la passation d’un contrat de concession de service public de gestion de l’aéroport de Nîmes Grande Provence Méditerranée.,Nîmes Métropole (30),2026-03-12,2026-04-07T10:00:00+00:00,APPEL_OFFRE,SERVICES,Assistance à maîtrise d'ouvrage,79111000,30,https://www.boamp.fr/pages/avis/?q=idweb:26-24796,nature APPEL_OFFRE | type SERVICES | + fort: assistance a maitrise d ouvrage,26-24796
KEEP_MEDIUM,SECONDARY,OTHER_RELEVANT,13,DIAG_THEATRE,COMMUNE DE DIE,2026-03-12,2026-05-22T12:00:00+00:00,APPEL_OFFRE,SERVICES,Maîtrise d'oeuvre,,26,https://www.boamp.fr/pages/avis/?q=idweb:26-25547,nature APPEL_OFFRE | type SERVICES | + fort: maitrise d oeuvre,26-25547
KEEP_MEDIUM,CORE,AMO_PROGRAMMING,13,Etude d'actualisation de l'inventaire et de la caractérisation des zones humides et des zones à potentiel de création de milieux humides sur le territoire du SAGE Marne Confluence,Marne Vive,2026-03-11,2026-05-07T18:00:00+00:00,APPEL_OFFRE,SERVICES,Etude,71335000,77 | 75 | 93 | 94,https://www.boamp.fr/pages/avis/?q=idweb:26-25111,nature APPEL_OFFRE | type SERVICES | CPV secondaire 71335000 | + moyen: etude,26-25111
KEEP_MEDIUM,CORE,URBANISM_LANDSCAPE,13,"Prestations intellectuelles d'expertises immobilières pour des biens immobiliers dans toute la France, principalement à Paris et en Région Ile de France",Ville de Paris - Direction de l&#039;urbanisme,2026-03-11,2026-04-13T11:00:00+00:00,APPEL_OFFRE,SERVICES,Prestations de services,70100000,75,https://www.boamp.fr/pages/avis/?q=idweb:26-24086,nature APPEL_OFFRE | type SERVICES | + fort: urbanisme,26-24086
KEEP_MEDIUM,SECONDARY,ENGINEERING,13,"Elaboration d'une réglementation des boisements pour cinq secteurs géographiques sur le Département du Puy-de-Dôme (secteurs Pionsat, Saint-Gervais-d'Auvergne, Saint-Eloy-les-Mines",Département du Puy-de-Dôme,2026-03-11,2026-04-13T12:00:00+00:00,APPEL_OFFRE,SERVICES,Etude | Prestations de services,71335000,63,https://www.boamp.fr/pages/avis/?q=idweb:26-25073,nature APPEL_OFFRE | type SERVICES | CPV secondaire 71335000 | + moyen: etude,26-25073
KEEP_MEDIUM,CORE,AMO_PROGRAMMING,13,Mission de Programmation et d’Assistance à Maîtrise d’Ouvrage projet de construction bâtiment neuf (activités de recherche universitaire) site Tonnellé Université de Tours.,Université de Tours,2026-03-11,2026-04-08T16:00:00+00:00,APPEL_OFFRE,SERVICES,Assistance à maîtrise d'ouvrage,,37,https://www.boamp.fr/pages/avis/?q=idweb:26-25440,nature APPEL_OFFRE | type SERVICES | + fort: assistance a maitrise d ouvrage,26-25440
KEEP_MEDIUM,CORE,ARCHITECTURE_BUILDING,13,Marche de maîtrise d’œuvre d’exécution avec mission d’OPC pour des travaux de rénovation et de réhabilitation de locaux à l’EHPAD Jean-François de Hautefort.,EHPAD Hautefort,2026-03-11,2026-04-01T16:00:00+00:00,APPEL_OFFRE,SERVICES,"Maîtrise d'oeuvre | Mission d'ordonnancement, pilotage, coordination (OPC)",71000000,19 | 24 | 33 | 87,https://www.boamp.fr/pages/avis/?q=idweb:26-25376,nature APPEL_OFFRE | type SERVICES | CPV fort 71000000 | + fort: maitrise d oeuvre | + moyen: rehabilitation | + moyen: etude | - fort: fourniture | - fort: fournitures,26-25376
KEEP_MEDIUM,CORE,AMO_PROGRAMMING,13,2026-14PE ASSISTANCE A MAITRISE D'OUVRAGE POUR LA REVISION DU SCoTER-.,Pôle d'Equilibre Territorial et Rural du Pays d'Epernay Terres de Champagne,2026-03-11,2026-04-07T12:00:00+00:00,APPEL_OFFRE,SERVICES,Assistance à maîtrise d'ouvrage,,51,https://www.boamp.fr/pages/avis/?q=idweb:26-25306,nature APPEL_OFFRE | type SERVICES | + fort: assistance a maitrise d ouvrage,26-25306
KEEP_MEDIUM,SECONDARY,ENGINEERING,13,Contrôleur technique,"TRANSAMO, mandataire de la Communauté urbaine de Le Mans Métropole",2026-03-11,2026-04-13T10:00:00+00:00,APPEL_OFFRE,SERVICES,Ingénierie,71356100,72,https://www.boamp.fr/pages/avis/?q=idweb:26-24100,nature APPEL_OFFRE | type SERVICES | CPV secondaire 71356100 | + moyen: ingenierie,26-24100
KEEP_MEDIUM,CORE,AMO_PROGRAMMING,13,ACCORD CADRE A BON DE COMMANDE POUR UNE ASSISTANCE A MAITRISE D'OUVRAGE DE PRESTATIONS FONCIERES,Syndicat Mixte du Bassin Versant du Gapeau (83),2026-03-10,2026-04-17T12:00:00+00:00,APPEL_OFFRE,SERVICES,Assistance à maîtrise d'ouvrage,79418000,83,https://www.boamp.fr/pages/avis/?q=idweb:26-24867,nature APPEL_OFFRE | type SERVICES | + fort: assistance a maitrise d ouvrage,26-24867
KEEP_MEDIUM,SECONDARY,ENGINEERING,13,"Etudes hydrogéologiques, fluviales et environnementales",La Régie Eau du Grand Lyon,2026-03-10,2026-04-24T10:00:00+00:00,APPEL_OFFRE,SERVICES,Etude,71335000,69,https://www.boamp.fr/pages/avis/?q=idweb:26-23905,nature APPEL_OFFRE | type SERVICES | CPV secondaire 71335000 | + moyen: etude,26-23905
KEEP_MEDIUM,SECONDARY,ENGINEERING,13,Etude préalable à la restauration écologique du Bié de Colombier-Fontaine,Ca Pays De Montbeliard Agglomeration,2026-03-10,2026-04-10T17:00:00+00:00,APPEL_OFFRE,SERVICES,Etude,71313000,25,https://www.boamp.fr/pages/avis/?q=idweb:26-24670,nature APPEL_OFFRE | type SERVICES | CPV secondaire 71313000 | + moyen: etude,26-24670
KEEP_MEDIUM,SECONDARY,OTHER_RELEVANT,13,Marché de maîtrise pour la restauration du mur de soutènement Parking Pierre Marchal situé sur le Chemin de Halage - OA95,Ville de Thionville,2026-03-09,2026-04-09T14:00:00+00:00,APPEL_OFFRE,SERVICES,Maîtrise d'oeuvre | Mur de soutènement,,57,https://www.boamp.fr/pages/avis/?q=idweb:26-24318,nature APPEL_OFFRE | type SERVICES | + fort: maitrise d oeuvre,26-24318
KEEP_MEDIUM,CORE,AMO_PROGRAMMING,13,Prestations d'assistance à maitrise d'ouvrage pour la passation de contrats d'assurance,Inria,2026-03-09,2026-04-10T17:00:00+00:00,APPEL_OFFRE,SERVICES,Assistance à maîtrise d'ouvrage | Prestations de services,79311000,78,https://www.boamp.fr/pages/avis/?q=idweb:26-23877,nature APPEL_OFFRE | type SERVICES | + fort: assistance a maitrise d ouvrage,26-23877
KEEP_MEDIUM,CORE,AMO_PROGRAMMING,13,Mission d'assistance pour la mise en place du contrat groupe d'assurance des risques statutaires,Centre de Gestion FPT Loire-Atlantique,2026-03-09,2026-03-27T12:00:00+00:00,APPEL_OFFRE,SERVICES,Assistance à maîtrise d'ouvrage,,44,https://www.boamp.fr/pages/avis/?q=idweb:26-23932,nature APPEL_OFFRE | type SERVICES | + fort: assistance a maitrise d ouvrage,26-23932
KEEP_MEDIUM,SECONDARY,OTHER_RELEVANT,13,MOE LAS CANALS,Mairie de Perpignan,2026-03-09,2026-04-10T12:00:00+00:00,APPEL_OFFRE,SERVICES,Maîtrise d'oeuvre | Ouvrage hydraulique,,66,https://www.boamp.fr/pages/avis/?q=idweb:26-24206,nature APPEL_OFFRE | type SERVICES | + fort: maitrise d oeuvre,26-24206
KEEP_MEDIUM,SECONDARY,OTHER_RELEVANT,13,Marché de maîtrise d'oeuvre pour la création d'un Carrefour à feux sur l'Avenue Comte de Bertier et la Rue Saint-Fiacre,Ville de Thionville,2026-03-09,2026-04-10T14:00:00+00:00,APPEL_OFFRE,SERVICES,Maîtrise d'oeuvre,,57,https://www.boamp.fr/pages/avis/?q=idweb:26-24320,nature APPEL_OFFRE | type SERVICES | + fort: maitrise d oeuvre,26-24320
KEEP_MEDIUM,CORE,AMO_PROGRAMMING,13,"Prestations de conseil en ressources humaines et transformation organisationnelle, finances, et en assurances",RESAH,2026-03-07,2026-04-06T10:00:00+00:00,APPEL_OFFRE,SERVICES,Prestations de services,66171000 | 66519310 | 79414000,75,https://www.boamp.fr/pages/avis/?q=idweb:26-23061,nature APPEL_OFFRE | type SERVICES | + fort:  amo ,26-23061
KEEP_MEDIUM,SECONDARY,ENGINEERING,13,Réalisation de l’actualisation du diagnostic périodique et du schéma directeur du système d’assainissement des eaux usées et réalisation de l’actualisation et de l’approfondissement du schéma directeu,Mairie de Sainte-Hélène,2026-03-07,2026-04-07T17:00:00+00:00,APPEL_OFFRE,SERVICES,Etude,71335000,33,https://www.boamp.fr/pages/avis/?q=idweb:26-23753,nature APPEL_OFFRE | type SERVICES | CPV secondaire 71335000 | + moyen: etude,26-23753
KEEP_MEDIUM,CORE,AMO_PROGRAMMING,13,"Mission d'assistance à maîtrise d'ouvrage construction de l'école maternelle Michel Noir suite à la liquidation judiciaire du titulaire 
Phase 5  et 6 du contrat initial",VILLE DE LURE,2026-03-06,2026-03-20T12:00:00+00:00,APPEL_OFFRE,SERVICES,Assistance à maîtrise d'ouvrage | Assistance juridique | Assistance technique,,70,https://www.boamp.fr/pages/avis/?q=idweb:26-23428,nature APPEL_OFFRE | type SERVICES | + fort: assistance a maitrise d ouvrage,26-23428
KEEP_MEDIUM,CORE,AMO_PROGRAMMING,13,Mission d'assistance à maîtrise d'ouvrage pour la maîtrise foncière par voie amiable et par expropriation de biens du quartier Centre-ville Béthisy à Noisy-le-Sec,Spl Ensemble,2026-03-06,2026-04-10T12:00:00+00:00,APPEL_OFFRE,SERVICES,Assistance à maîtrise d'ouvrage,79418000,93,https://www.boamp.fr/pages/avis/?q=idweb:26-23715,nature APPEL_OFFRE | type SERVICES | + fort: assistance a maitrise d ouvrage,26-23715
KEEP_MEDIUM,SECONDARY,ENGINEERING,13,"Ordonnancement, Pilotage, Coordination de chantier pour la construction du bâtiment Trainings au lycée Saint Exupéry à Blagnac (Opération n° 50316)",Spl Arac Occitanie,2026-03-06,2026-03-31T12:00:00+00:00,APPEL_OFFRE,SERVICES,"Mission d'ordonnancement, pilotage, coordination (OPC)",71521000,31,https://www.boamp.fr/pages/avis/?q=idweb:26-23230,nature APPEL_OFFRE | type SERVICES | CPV secondaire 71521000 | + moyen: amenagement,26-23230
KEEP_MEDIUM,SECONDARY,ENGINEERING,13,Etudes techniques,Service d'Infrastructure de la Défense Sud-Est,2026-03-06,2026-04-14T15:00:00+00:00,APPEL_OFFRE,SERVICES,Etude,71335000,30,https://www.boamp.fr/pages/avis/?q=idweb:26-22628,nature APPEL_OFFRE | type SERVICES | CPV secondaire 71335000 | + moyen: etude,26-22628
KEEP_MEDIUM,SECONDARY,ENGINEERING,13,évaluation et évolution du dispositif des paiements pour services environnementaux de l'Agglo du Pays de Dreux,Ca du Pays de Dreux,2026-03-06,2026-04-13T12:00:00+00:00,APPEL_OFFRE,SERVICES,Ingénierie,71313000,28 | 27 | 78 | 45,https://www.boamp.fr/pages/avis/?q=idweb:26-23550,nature APPEL_OFFRE | type SERVICES | CPV secondaire 71313000 | + moyen: ingenierie,26-23550
KEEP_MEDIUM,CORE,AMO_PROGRAMMING,13,"Mission d'assistance à maîtrise d'ouvrage juridique, financière et technique pour l'accompagnement dans le choix et l'assistance au déploiement du ou des modes d'exploitation reten",Syndicat des Eaux Creusoises,2026-03-05,2026-05-04T12:00:00+00:00,APPEL_OFFRE,SERVICES,Prestations de services,71356200,23,https://www.boamp.fr/pages/avis/?q=idweb:26-22972,nature APPEL_OFFRE | type SERVICES | CPV secondaire 71356200 | + fort: assistance a maitrise d ouvrage | - moyen: accompagnement,26-22972
KEEP_MEDIUM,SECONDARY,ENGINEERING,13,Mission de maitrise d'oeuvre pour la sécurisation électrique des ouvrages d'eau potable - 2 lots,SYNDICAT EAU47,2026-03-05,2026-03-26T12:00:00+00:00,APPEL_OFFRE,SERVICES,Réservoir | Etude | Matériel électrique,,47,https://www.boamp.fr/pages/avis/?q=idweb:26-22670,nature APPEL_OFFRE | type SERVICES | + fort: maitrise d oeuvre | + fort: mission de maitrise d oeuvre | + moyen: etude | - fort: materiel,26-22670
KEEP_MEDIUM,SECONDARY,ENGINEERING,13,MISSION CSPS AUX OPERATIONS DE TRAVAUX SUR LES POLES D'ECHANGES MULTIMODAUX,PARIS TERRES D'ENVOL,2026-03-05,2026-04-07T12:00:00+00:00,APPEL_OFFRE,SERVICES,"Bâtiment | Sécurité incendie | Mission d'ordonnancement, pilotage, coordination (OPC)",71317200,93,https://www.boamp.fr/pages/avis/?q=idweb:26-21882,nature APPEL_OFFRE | type SERVICES | CPV secondaire 71317200 | + moyen: amenagement,26-21882
KEEP_MEDIUM,SECONDARY,ENGINEERING,13,MISSIONS OPC POUR LES TRAVAUX DE DU PROJET DE MODERNISATION d'ADAPTation et d'Extension du Terminal 1 de l'aéroport Guadeloupe Maryse Condé,Société Aéroportuaire Guadeloupe Pôle Caraibes (SAGPC),2026-03-05,2026-03-20T16:00:00+00:00,APPEL_OFFRE,SERVICES,"Mission d'ordonnancement, pilotage, coordination (OPC)",71521000,971,https://www.boamp.fr/pages/avis/?q=idweb:26-22096,nature APPEL_OFFRE | type SERVICES | CPV secondaire 71521000 | + moyen: amenagement,26-22096
KEEP_MEDIUM,SECONDARY,OTHER_RELEVANT,13,Maîtrise d'oeuvre relative à l'extension du réseau d'eaux usées et eau potable sur la commune de CUSSY,COMMUNAUTE DE COMMUNES DE BAYEUX INTERCOM,2026-03-05,2026-04-08T12:00:00+00:00,APPEL_OFFRE,SERVICES,Maîtrise d'oeuvre,,14,https://www.boamp.fr/pages/avis/?q=idweb:26-23140,nature APPEL_OFFRE | type SERVICES | + fort: maitrise d oeuvre,26-23140
KEEP_MEDIUM,SECONDARY,ENGINEERING,13,Missions d'assistance en ingénierie administrative sur les marchés publics du Gpmg - Relance,Grand Port Maritime Guadeloupe,2026-03-05,2026-03-23T12:00:00+00:00,APPEL_OFFRE,SERVICES,Ingénierie | Prestations de services,71336000,971,https://www.boamp.fr/pages/avis/?q=idweb:26-23191,nature APPEL_OFFRE | type SERVICES | CPV secondaire 71336000 | + moyen: ingenierie,26-23191
KEEP_MEDIUM,SECONDARY,ENGINEERING,12,"ETUDE PRELIMINAIRE A UNE ETUDE DE DANGER :
DIGUE DES BEAUSSIERES A SIGNES (83)",Syndicat Mixte du Bassin Versant du Gapeau (83),2026-03-16,2026-04-24T12:00:00+00:00,APPEL_OFFRE,SERVICES,Digue | Génie civil | Rivières/ruisseaux | Ingénierie,,83,https://www.boamp.fr/pages/avis/?q=idweb:26-27219,nature APPEL_OFFRE | type SERVICES | + moyen: etude | + moyen: ingenierie,26-27219
